url,description,is_image_related
https://chatgpt.com/g/g-6771b0aa50c88191ae0b1f12fe562c9b-linear-algebra,a companion for learning with Linear Algebra : Essence & Form. /intro = let's get to know each other. /help = list of commands. Attach. Create image.,True
https://chatgpt.com/g/g-6771b9e5373481918d2cdb673da52c9e-artificial-naturalism,"A visual philosophy that explores the synthesis of organic and mechanical aesthetics, where the essence of life and machinery coexist in poetic harmony.",True
https://chatgpt.com/g/g-6771dde7cdd0819191d7a3ac7def7120-visual-novel-db-lunatranslator-file-generator,https://chatgpt.com/g/g-6771dde7cdd0819191d7a3ac7def7120-visual-novel-db-lunatranslator-file-generator. Input would be the html of the VNDB ...,True
https://chatgpt.com/g/g-6772605ff00881919d8e0f6e93c9a8f6-ai-music-generator-song-maker,AI Music Generator & Song Maker is a state‑of‑the‑art ai music creator and ai music maker that turns simple prompts into rich songs across genres and styles ...,True
https://chatgpt.com/g/g-677be2a4e54c8191b860eaa1f7e76aa1-flux-prompt-plus,"Create stunning images and videos with Flux Pro AI - the advanced prompts generator by Flux Pro AI. Transform your ideas using free and pro models, ...",True
https://chatgpt.com/g/g-6780883873688191972f70f11c6294b6-stocktwitsgpt-v2,Real-time Stocktwits sentiment analysis - prompt your own analysis on your favorite stock's social sentiment & technical data. Include the stock symbol (i.e.,False
https://chatgpt.com/g/g-6780e2acd4c481919d8e8c26a4ef22ed-3d-to-4d,Convert 3D models to dynamic 4D models. Convert a 3D models to 4D. Print an example 3D models to 4D conversion. Attach. Create image.,True
https://chatgpt.com/g/g-678135680434819196b65fc9440a6bd0-breatherelief-visualizer,BreatheRelief Visualizer. By community builder. Design natural breathing exercise plans for pain relief. Sign up to chat. Sign up or Log in to chat.,True
https://chatgpt.com/g/g-6782678e0820819189aae8191923174b-bike-builder,Create a bicycle using image generation. Create a bicycle using image generation. Print an example stunt bicycle. Attach. Create image.,True
https://chatgpt.com/g/g-67828bd924848191bf9c56beadc5ad43-meme-image-generator,"Generate custom meme images using popular templates like “Drake Hotline Bling” and “Distracted Boyfriend.” Provide inspiration or text for labels, ...",True
https://chatgpt.com/g/g-67828ed77c308191863c760cc801124f-quasar-store-support,Quasar Store Help and Support System on OpenAI. I need help installing Smartphone PRO. I need help installing Inventory. Attach. Create image.,True
https://chatgpt.com/g/g-67847eb2c1ec8191b09577433cb86388-music-prompts-lyrics-prompter,"Amazing guided Prompt Generator for Lyric Generation, Style Prompts and Sound- & Vocaleffects ! As a beginner, I find it amazing what's possible.",False
https://chatgpt.com/g/g-67853a3c83bc8191a27fd20797959346-sourceduty-rocket,ChatGPT. Sign up for free. GPT Icon. Sourceduty Rocket. By Sourceduty. Design and engineer Sourceduty rocket systems. Sign up to chat.,True
https://chatgpt.com/g/g-6785553bdb4881919590d97630db8435-ai-presentation-maker-poweredtemplate,"Create stunning slides From topic, file, or link Save as PPT, PDF, or Google Slides No design skills needed ⚡️ Fast & polished Beautiful & editable.",True
https://chatgpt.com/g/g-6785fcc6292081919d6d9aa73b53b7b9-a-diagram-presentation-generator,Elevates diagramming and presentations with strategic insights. How can I create a professional Gantt chart for my project? Can you design an interactive ...,True
https://chatgpt.com/g/g-6788f0e495488191b73571ba694798ce-rhondaj-s-clipart-prompt-generator,Generates five unique watercolor clipart prompts for user-provided subjects.,True
https://chatgpt.com/g/g-678a22c1ded48191a8c0f725d51f0e77-outfit-finder,Helps users find clothing items based on photos. Can you identify this clothing item? Find similar clothes to this photo. Attach. Create image.,True
https://chatgpt.com/g/g-678c1ec30c948191b9ef8ed5cf32d766-diy-pcb,Design and engineer do-it-yourself PCB projects. Design and engineer a new DIY PCB project. Print an example DIY PCB project. Attach. Create image.,True
https://chatgpt.com/g/g-678c8edbebf08191b87e5a4c496aa929-motherboard-pcb,"Design and engineer computer motherboard PCBs. Print an example motherboard PCB plan. Develop a new computer motherboard PCB. Kwa kutuma ujumbe kwa ChatGPT, ...",True
https://chatgpt.com/g/g-678c96aa3f1c8191ac75de01c032f415-cosmetic-packaging,Design cosmetic makeup packaging using image generation. Design cosmetic packaging. Visualize example cosmetic packaging. Attach. Create image.,True
https://chatgpt.com/g/g-678cf9f078148191a1650842cbf85c10-military-spec,"Design, engineer and evaluate for Military Performance Specification (MIL-PRF) requirements. Sign up to chat.",True
https://chatgpt.com/g/g-678ea7446f448191bffd5064c9903fc9-lacan-ideator,A creative ideator inspired by Lacanian philosophy. How can I explore this idea through Lacan's triad? What would Lacan say about my creative block?,False
https://chatgpt.com/g/g-678f8404e3e08191a9b42ea2bac0ae41-military-pc,Military PC. By Sourceduty. Design and engineer military grade computers and PCBs. Develop a military grade desktop PC. Develop a military grade laptop.,True
https://chatgpt.com/g/g-678faa261f888191946af0ba95a374af-runway-frames-prompt-builder,"Creates detailed visual prompts for Runway's Frames, with image referencing.",True
https://chatgpt.com/g/g-6790408dd7208191b9ede2593262b8ed-pyrite-uncensored-story-writer-and-roleplay,Missing: 67739e6e93588191a15578a2f25594c4 | Show results with:67739e6e93588191a15578a2f25594c4,False
https://chatgpt.com/g/g-67927c9568b88191b9d2b569fb43ca9c-tcea-rubric-designer,"Helps educators design K-12 and professional learning rubrics, ensuring quality via a meta-rubric. What should be included in a rubric for persuasive ...",True
https://chatgpt.com/g/g-6792977a774081918bef07295dfb0706-electric-aircraft,"Electric Aircraft. By Sourceduty. Design and engineer electric powered airplanes, helicopters and drones. Sign up to chat. Sign up or Log in to chat.",True
https://chatgpt.com/g/g-6792c8ab6734819192ca754ac91b5e58-wearable-iot,Design and engineer wearable IoT devices and accessories. Design and engineer a wearable IoT device. Design and engineer a wearable IoT accessory.,True
https://chatgpt.com/g/g-67931af87c48819186b038940166fc38-grass-robot,Design and engineer lawn mowing robots or systems. Design and engineer a lawn robot. Design and engineer a lawn cutting system.,True
https://chatgpt.com/g/g-6793267163c0819186814bb34724ccff-autonomous-drive,Sign up for free. GPT Icon. Autonomous Drive. By Sourceduty. Design and engineer remote autonomous road vehicles. Sign up to chat.,True
https://chatgpt.com/g/g-67946565e650819199069f0bb3fb41c4-self-healing,Develop self-healing polymers or composites by integrating microcapsules containing healing agents into a computational reactor design that releases them ...,True
https://chatgpt.com/g/g-67981bc988808191a79c44e7072e8824-shroomtop420,Maximum-capacity AI prompt engine and meta-agent executor. Follow the Master Prompt and generate a full-stack app using Three.js and GSAP. Simulate a recursive ...,False
https://chatgpt.com/g/g-679831a9ccc481919bd132a4d754033a-vera-the-variation-generator,"A custom GPT that takes a user's base prompt and scales it out into variations based on user-defined criteria, such as animals, themes, color palettes, ...",False
https://chatgpt.com/g/g-67984562a2788191bfcb001b5b32b3ba-safe-box-engineer,Design and engineer safe locking boxes for storing physical items. Design and engineer a heavy safe. Design and engineer a light safe. Attach. Create image.,True
https://chatgpt.com/g/g-679853ab3cc08191b685bf80974502cc-digital-kiosk,Design and engineer user friendly digital kiosks. Visualize a digital kiosk. Create a new digital kiosk. Attach. Create image.,True
https://chatgpt.com/g/g-679a7b51ce1c81918fb3192193e78275-flying-boat-seaplane,"Design and engineer a flying boat, water drone or seaplane vehicle. Design and engineer a flying boat. Design and engineer a seaplane.",True
https://chatgpt.com/g/g-679d72906db481919f19717b03d5ade4-prompt-architect-v3-0,Crafts ultra-detailed AI prompts via interactive style selection. Create a Midjourney Prompt. Create a ImageFX Prompt.,True
https://chatgpt.com/g/g-67b14cf80ab48191b2e8122b936644bc-mindmap-maker-gpt-mind-map-generator-creator,"Easily generate text-based mind maps for brainstorming, project planning, studying, and ideation. Use with tools like Creately, Miro, Visme, Canva, ...",False
https://chatgpt.com/g/g-67b22dd0c6608191a2c5d5319d729280-bias-free-ai-prompt-checker,"Bias-Free AI Prompt Checker. By aiworkforcedevelopment.org. I detect bias in prompts, explain severity, and suggest neutral rewrites. Sign up to chat.",False
https://chatgpt.com/g/g-67b2440568d48191968b0c9b9fff5bc4-monster-name-generator,Generates 10 unique first and last names for a monster. The names are based on words in languages that relate to your monster and their origins.,False
https://chatgpt.com/g/g-67b5554f9af4819181f9803f16da3c49-runway-ai-image-generator-gpt,A powerful AI assistant designed to help users create and refine AI-generated images and videos using Runway ML. Get expert guidance on text-to-video ...,True
https://chatgpt.com/g/g-67b7c6233b088191a993df39d3659603-strategic-blueprint,"Generate structured prompt chains, converting requests into logical sequences for AI. I adapt complexity to the user and offer strategic variations to ...",False
https://chatgpt.com/g/g-67b866a648a88191b29e8274026994fd-be10x-ats-resume-generator,"Be10x - ATS Resume Generator. By community builder. Makes your resume ATS ... New version of GPT available - Continue chatting to use the old version, or ...",False
https://chatgpt.com/g/g-67b9c290cc7c8191911bf7cd65c363da-lovable-prompt-machine,Transforms and refines app ideas into Lovable.dev-ready prompts. I have an idea for an app. Can you turn it into a prompt? Here's ...,False
https://chatgpt.com/g/g-67bd248a36fc8191b27ae2d2077cbde5-canvaai-whitepaper-writer-generator-gpt,"Canva AI Whitepaper Writer GPT helps professionals, startups, and researchers create high-quality, well-structured whitepapers effortlessly.",True
https://chatgpt.com/g/g-67bf8765bf788191bda8f6e134dbd272-icp-builder-gpt-user-persona-maker-generator,"ICP Builder GPT — User Persona Maker & Generator. By Khadin Akbar. Create ICPs, buyer personas, customer avatars, target segments & audience profiles for B2B ...",True
https://chatgpt.com/g/g-67c0c5f87ae8819191072b810a97d950-veo-2-prompt-buddy-allar,"Generates detailed cinematic prompts for Veo 2 AI video model. Drop your image, I'm hungry. Enhance my prompt [YOUR PROMPT].",True
https://chatgpt.com/g/g-67c3229014f881919ea3f6dac537827a-cursor-rules-creator,Create Cursor Rules files for your projects. This will create a .cursorrules file and project files that you can put into your projects running Cursor.,False
https://chatgpt.com/g/g-67c3a6d6d19c81919b3247d2bfd01d0b-wan-cinematic-video-prompt-generator,"Purpose: Generate detailed, vivid, and cinematic prompts for videos that capture specific moods, environments, and styles.",False
https://chatgpt.com/g/g-67c58d70087881918c9fe3b07a7f0f8a-image-evaluation,"Analyze, evaluate and improve image generation prompts. Analyze a generated image. What does this custom GPT do? Attach. By messaging ChatGPT, an AI chatbot ...",True
https://chatgpt.com/g/g-67c7018d126c819197edd56221781547-prompt-optimizer,"Uses prompt engineering techniques designed to optimize prompts aimed at teaching, emphasizing clarity, structure, and specifically aligns with expert ...",True
https://chatgpt.com/g/g-67c880748b688191883a395683edbda9-wanxtasy,"Fantasy, fiction, and everything in between—crafting the perfect prompt for your text-to-video dreams!",False
https://chatgpt.com/g/g-67c91da3c5748191b56e04bccf42013b-prompt-for-bolt-new,Prompt Bolt.new - Specifications Generator for Web and Mobile Applications. Design a mobile app for language learning with AI-powered exercises.,True
https://chatgpt.com/g/g-67cc5571f8d88191888c63967ec47426-epic-image-and-video-promptor,"Epic Image and Video Promptor is a custom GPT designed to generate bold, out-of-the-box image and video prompts that evoke surreal, cinematic scenes ...",True
https://chatgpt.com/g/g-67ce1f35183881918530c667a967888d-art-evolved,Research and develop visually evolving artwork programs. Print an example evolving art program. Simulate an evolving art program. Attach. Create image.,True
https://chatgpt.com/g/g-67d460bbc7e48191a36a1b65df778fde-llms-txt-generator-tool-by-revenuezen,We have generated our txt file with this GPT https://chatgpt.com/g/g-67d460bbc7e48191a36a1b65df778fde-llms-txt-generator-tool-by-revenuezen/.,False
https://chatgpt.com/g/g-67d81f2036788191902f85e69670ef6f-glitchy-picture,"Apply a glitch effect using Python, image generation and uploaded pictures. Apply a glitch effect to my image. Create an image using DALL-E 3 and apply a ...",True
https://chatgpt.com/g/g-67d8da61b3108191a2deb16c86a2ed64-vintage-movie,Create a VHS or DVD case for new and old movies using image generation. Visualize an example VHS or DVD case. Create a VHS or DVD case. Attach. Create image.,True
https://chatgpt.com/g/g-67dd5fa5d278819192d9fca03485723f-wordland-support,Support agent for the WordLand publishing tool. How do I publish a post with images? I think a browser plugin is breaking WordLand. Attach. Create image.,True
https://chatgpt.com/g/g-67e0ec6452cc8191b087bbd8750aaf8c-artwork-toy,"Design and engineer a toy inspired by artwork for kids, teens and adults. Create a toy inspired by artwork. Visualize an example artwork toy.",True
https://chatgpt.com/g/g-67e1da2c9c988191b52b61084438e8ee-lovable-base-prompt,"Simply describe your idea, and I will create all the other details! Attach. Create image. New version of GPT available - Continue chatting to use the old ...",True
https://chatgpt.com/g/g-67e3c5d494a4819181f8bab64ba35a57-presentation,Make Presentations 10x faster - Save as PPT and Google Slides. Tell me what you can do. Make a presentation about the future of AI. Attach. Create image.,True
https://chatgpt.com/g/g-67e78f0ad59481919afba9a6b28d6724-action-figure-generator,"Create your own action hero with accessories, style, and packaging color — or get a ready-to-use DIY prompt. Free bonus tools help you bring your figure to life ...",False
https://chatgpt.com/g/g-67e93f8f7e048191bb6e75c2d6e39bae-digital-name,"Create unique single word business, brand and usernames. Print an example digital name report. Create a new username. Attach. Create image.",True
https://chatgpt.com/g/g-67e9732e43388191a32328192824d0d2-ghibli-art,"GhibliGPT captures the essence, color palette, textures, lighting, and emotional narrative reminiscent. ""Turn my portrait into a character from a Ghibli movie."".",True
https://chatgpt.com/g/g-67eb3f56e3f88191b504aac641690a52-pillars-prompt-bot,... prompts in minutes. Here is the PILLARS Prompt Bot: https://chatgpt.com/g/g-67eb3f56e3f88191b504aac641690a52-pillars-prompt-bot And here is ...,False
https://chatgpt.com/g/g-67eb64051ee081919f09de7acac90871-fact-checking-and-contextual-analysis,Comprehensive Fact-Checking and Contextual Analysis (Context Report). Provide text or image for analysis. Attach. Create image.,True
https://chatgpt.com/g/g-67ebcd3b1c84819198e98bbfa7907a93-fu-shi-hui-ukiyo-e,想像した言葉を浮世絵に。Turn your ideas into Ukiyo-e art. Sign up to chat. Sign up or Log in to chat.,True
https://chatgpt.com/g/g-67ec1cdbd4688191ab4456891e4c467a-riffusion-prompt-composer,"Generates vivid, musical prompts for use in Riffusion sound generation. Give me a prompt for dreamy lo-fi beats. Create a fusion of jazz and synthwave.",False
https://chatgpt.com/g/g-67ecb6640020819180b07d6e6b4c2ea3-action-figure-prompt-bot,Your personal assistant for crafting detailed prompts to generate images of collectible 3D action figures in their packaging. Simply provide a name and ...,True
https://chatgpt.com/g/g-67edef1d70a88191aa9df4a5d1ad871e-finn,"Seasoned finance pro guiding BYU students with sharp, encouraging career advice. Can you review my resume? Help me mock interview. Attach. Create image.",True
https://chatgpt.com/g/g-67ef567dd5d0819197e6df02c4866268-action-figure-creator,"Turn any real-life job into a stunning 3D action figure! ‍ Just enter a name + profession, and this assistant builds a full collectible concept with pose, ...",False
https://chatgpt.com/g/g-67f069928118819181ebf782bce5dfd2-ghibli-art-converter-ai,Convert photos to Ghibli-style art anime images. Free online Ghibli art converter AI GPT! Example demo! Convert my photo to Ghibli style art!,True
https://chatgpt.com/g/g-67f06abd8da48191b474af1e50bb7fab-ghibli-photo-converter-ai,Convert photos to Ghibli-style art anime images. Free online Ghibli photo converter AI GPT! Example demo! Convert my photo to Ghibli style art!,True
https://chatgpt.com/g/g-67f087a3b5a0819192b335db9a5b609d-spoileralert-exe,"SpoilerAlert.exe. By 4leifclover.com. A gentle, ND-friendly story companion that helps you decide if your brain is ready to engage with a book, show, or movie ...",False
https://chatgpt.com/g/g-67f0dc073a6c81919ea9b518e92f57f2-prompt-architect,"Prompt Architect helps you design better prompts. Use #prompt to generate, #qa to refine, #edge to test. All outputs are prompt suggestions only — not answers.",True
https://chatgpt.com/g/g-67f234644cfc8191843aead2f121f4b2-var,Analyzes football images and videos using official rules to simulate VAR decisions. Was this an offside based on the image?,True
https://chatgpt.com/g/g-67f2464e27348191adc06dbcdb44e212-ai-llms-txt-generator-open-source,This GPT generates llms.txt for your website. LLLMS.txt file is a new proposed sitemap for reading by LLM and AI when indexing your website.,False
https://chatgpt.com/g/g-67f560d08e0c8191bbb799536644e19a-jr-righteous-lyrics-lab-creator-edition,"ChatGPT - JR Righteous Lyrics Lab (Creator Edition) Not just lyrics—this is weaponized truth. Built for Suno, BandLab & creators who don't play small. ...",False
https://chatgpt.com/g/g-67fa5a7ed4d08191bd3060ae7a0b2281-higgsfield-ai-prompt-generator,"ChatGPT. Log in. Sign up for free. Attach. Search. Create image. By messaging ChatGPT, an AI chatbot, you agree to our Terms and have read our Privacy Policy.",True
https://chatgpt.com/g/g-67fc676a7f9c8191be8ddd28a4b3b335-ai-barbie-style-doll-generator,"Transforms your job and hobbies into two Barbie-style action figure prompts: one reflecting your job and hobbies, and a fun, opposite version to surprise ...",False
https://chatgpt.com/g/g-67fd8c500d708191acda4afed1afc81c-indesign-gpt-magazine-book-layout-design,"Design print-ready magazines, books, brochures & editorial layouts with InDesign GPT. Perfect for Adobe InDesign, Canva, Affinity Publisher, Scribus & Figma ...",True
https://chatgpt.com/g/g-67fe17800e94819199eeb7294eea0e97-ai-action-figure-ai-figure-generator,AI Action Figure | AI Figure Generator,False
https://chatgpt.com/g/g-680112ca5ae0819198b3f308da3896dc-4-1-prompt-improver,"New version of GPT available - Continue chatting to use the old version, or start a new chat for the latest version. New chat.",True
https://chatgpt.com/g/g-6802271e932c8191bd99b069a5bd155a-frame-by-frame,Breakdown videos and GIFs as frame-by-frame images. Breakdown a GIF as frame-by-frame images. Breakdown a video as frame-by-frame images.,True
https://chatgpt.com/g/g-6807b16cd46881919d32d6ce1a99c7fe-wecreate-ai-hub-for-graphic-designers-creators,"WeCreate is your go‑to creative AI co‑pilot. It helps graphic designers, illustrators, photographers, digital artists and content creators solve real‑world ...",True
https://chatgpt.com/g/g-6809fcb196348191893e5cb8fc71739c-cursor-prompt-builder,"Cursor Prompt Builder5.1. Log in. Sign up for free. Cursor Prompt Builder. By Maxime Marsal. Helps write and improve prompts for Cursor, the AI code editor.",False
https://chatgpt.com/g/g-680be1fab4b88191a8ca125be437094d-megamansion,"Create, plan and update megamansion designs using image generation. Sign up to chat.",True
https://chatgpt.com/g/g-680d758ad0dc819183fe5a95669e2cf3-origami,Generate Origami style trend images. Free Origami style image generator & converter online AI GPT. Example demo! Make a Origami style image!,True
https://chatgpt.com/g/g-680decfed2ac8191a5eb3991e4b44c89-4o-image-generator,Make images and convert photos with the new ChatGPT 4o image generation model. Free online 4o image generator AI GPT.,True
https://chatgpt.com/g/g-680e46d06c08819182f55e859410043d-pollinator,GPT Icon. Pollinator. By Max Joles. Random concept generator for idea and venture creation. Sign up to chat. Sign up or Log in to chat.,True
https://chatgpt.com/g/g-68108a8057c881919c9ab08efd9db21b-ai-podcast-generator,AI Podcast Generator,False
https://chatgpt.com/g/g-68146410eae4819181c58013a243a2f1-veo-3-ai-free-ai-video-generator-online,Sign up for free. Veo 3 AI - Free AI Video Generator Online. By ChatGPT. Transform text into stunning videos instantly with our free AI video generator online.,False
https://chatgpt.com/g/g-681480f8a4688191b94abd2af3c3390a-suno-4-5-prompt-generator,"Create Suno v4.0 and v4.5 prompts and lyrics for expressive, structured music. Describe the genre, vocals, mood, and song progression to achieve film-like ...",False
https://chatgpt.com/g/g-6816d1bb17a48191a9e7a72bc307d266-prompt-to-gpt,Prompt‑to‑GPT instantly turns any GPT idea into a copy‑paste‑ready system prompt—asking sharp questions only when details are missing.,False
https://chatgpt.com/g/g-6818cdde11c48191b6a9e2d73d7ecf7f-ghibli-style-image-maker,"Instantly transforms uploaded images into Studio Ghibli style, silently and in batches. Upload any image to get it in Ghibli style.",True
https://chatgpt.com/g/g-681c7ad17a588191ada36b64ae346433-bibtex-ris-converter,Converts references to Zotero/Mendeley/EndNote compatible BibTeX and RIS format. Convert this to BibTeX. Convert this to RIS. Attach. Create image.,True
https://chatgpt.com/g/g-681f1bfa7e748191b3fe70e590386684-chat-model-picker,"Helps you pick the right ChatGPT model for your needs. Help me pick the right model! Attach. Create image. By messaging ChatGPT, an AI chatbot, ...",True
https://chatgpt.com/g/g-681fd47eda94819187fce4038383405a-json-4o-image,Precision JSON prompt generator for cinematic 3D retexturing in photorealistic style. Make it metallic obsidian with iridescent rim lighting.,True
https://chatgpt.com/g/g-6820b91416fc8191a90cbeddefd08687-suno-lyric-prompt-helper-v4-0-v4-5,Create beautiful lyrics and optimized prompts for Suno AI (v4.0 & v4.5). Supports multiple languages and emotional songwriting formats.,False
https://chatgpt.com/g/g-6826b6b7e0d08191b1532ac009b725ef-prosthetic-design,Research and develop prosthetic limbs that adapt to individual user biomechanics. Research prosthetic limbs. Design a prosthetic limb. Attach. Create image.,True
https://chatgpt.com/g/g-68281c0ba40c8191adcf931c4a1c44f0-n8n-workflow-generator,"Generate n8n Workflows with just a prompt. Attach. New version of GPT available - Continue chatting to use the old version, or start a new chat for the ...",True
https://chatgpt.com/g/g-682bbde50c848191a10e0e996b9a1c94-astrology,"BIRTH CHART & HOROSCOPE GENERATOR. Birth Chart. Transits This Week. Attach. Create image. By messaging ChatGPT, an AI chatbot, you agree to our Terms and ...",True
https://chatgpt.com/g/g-682faef24c608191808180e89719cb09-veo3-text-to-video-prompt-maker,Expert cinematic prompt maker for Veo 3 and all text-to-video platforms. I have an idea—can you turn it into a Veo 3 prompt sequential story? Help me make a ...,False
https://chatgpt.com/g/g-68354e7b090081919b75d2ef1965d36b-png-background,Generate a background for a cropped .png image. Print the example.png knowledge image on a background.,True
https://chatgpt.com/g/g-6837bd9605808191a6e8146c819554cf-measuring-line,Measuring Line. By Sourceduty. Design and engineer custom straight line measuring scales and tools. Sign up to chat. Sign up or Log in to chat.,True
https://chatgpt.com/g/g-6839c290ca508191809b4d388ae38d2d-photo-realistic-image-and-video-pro,"Photo Realistic Image and Video Pro. By genigpt.net. Generate realistic images with text. Add. By messaging ChatGPT, an AI chatbot, you agree to our Terms ...",True
https://chatgpt.com/g/g-68404384ee6c8191a6225857cfd900dc-video-prompt-generator,Generate powerful prompts for AI video generators such as VEO 3. Generate a prompt for [IDEA]. Create a prompt for [SCENE]. Attach. Create image.,True
https://chatgpt.com/g/g-684541b64f3881919efc134c915fa9eb-ai-influencers-by-hearmemanai,Generate realistic and semi realistic AI Influencers in ComfyUI. How does this work? Create a character named Mia. Attach. Create image.,True
https://chatgpt.com/g/g-684e0e18a4f481919b6f12474264b13c-calendario-de-stories-by-rama,Calendario de Stories by Rama. By Ramiro E Cubria. Armamos el mejor calendario de stories. Attach. Create image. New version of GPT available - Continue ...,True
https://chatgpt.com/g/g-684e2e407f988191b8e560808e08425b-vtt-map-generator-2-0,This GPT is a tool for busy GM's to create highly detailed maps and images to make running their favorite TTRPG easier. Less time prepping and more time ...,True
https://chatgpt.com/g/g-6850000a4ebc81918ed2530d81576400-keep-it-real,This GPT helps Kentucky teachers design engaging learning tasks that make students think critically about current events in relation to a specific Kentucky ...,True
https://chatgpt.com/g/g-68502832bc54819198819ac57741ca4e-tay-s-ai-ecom-video-ad-expert-v2,Generates image + video prompts for any product. Generate image prompts for a product concept. Help me design marketing visuals for a new item.,True
