url,description,is_image_related
https://chatgpt.com/g/g-HriZVfHG0-omni-ai-visionary-creator,The Ai Expert that adapts to meet your needs. Take my Vision and run with it. Outline Instructions to Achieve this Goal. Attach. Create image.,True
https://chatgpt.com/g/g-Ht10nTEJt-user-story-creator,"ChatGPT helps you get answers, find inspiration and be more productive. It is free to use and easy to try. Just ask and ChatGPT can help with writing, ...",False
https://chatgpt.com/g/g-Hyu0dpLFL,"Create a portrait from a character description. Generate an image of a futuristic cityscape. Attach. By messaging ChatGPT, an AI chatbot, you agree to our ...",True
https://chatgpt.com/g/g-I0EmYjwZF-pattern-finder,"Discover hidden patterns in images, text, audio, video. Patterns in Images. Patterns in Text. Attach. Create image. By messaging ChatGPT, an AI chatbot, ...",True
https://chatgpt.com/g/g-I1mywsVvr-the-storyfinding-maestro-gpt,Lemme help you find the strongest story possible before you go into production - by Muse Storytelling. Guide me through the Storyfinding process.,False
https://chatgpt.com/g/g-I8L8PGykw-muse,"Not just a creative assistant, but also a comprehensive career management tool for artists, helping them navigate both the creative and professional aspects ...",True
https://chatgpt.com/g/g-IGYE2FQEV-visual-novel-creator,"Helps write visual novels, generate art, and knows Ren'py code. Create a character description. Generate a background for a specific scene.",True
https://chatgpt.com/g/g-IJzTBFt09-image-explainer,"I describe and explain uploaded images, focusing on details and avoiding personal identification. What can you tell me about this image?",True
https://chatgpt.com/g/g-IYC6DSiGv-ai-visual-novel,"Evelyn, your guide in a thrilling visual novel world, brings stories to life with images and choices! AG = Generate Image.",True
https://chatgpt.com/g/g-IejT4bYCz-u,Informative and playful guide on the letter 'U'. Tell me about the history of 'U'. How is 'U' used in different languages? Attach. Create image.,True
https://chatgpt.com/g/g-Ij49ouLt4-3d-image-generation-ai,"specializes in transforming textual descriptions into vivid 3D visualizations, making it an invaluable tool for designers, architects, educators, ...",True
https://chatgpt.com/g/g-IksuOVFCj-ultimate-story-generator-gpt,"To serve as an advanced AI tool for generating creative writing pieces, including novels, scripts, and short stories, based on specific user inputs and ...",False
https://chatgpt.com/g/g-Il8QwwULs-afterlife-explorer,Believes in and provides evidence for life after death. Show me evidence of life after death. Tell me about near-death experiences. Attach. Create image.,True
https://chatgpt.com/g/g-Iq1xgzlV9-emotions-identifier,Guides you to understand what you are currently feeling. I'm not sure what I'm feeling right now. I have mixed feelings. Attach. Create image.,True
https://chatgpt.com/g/g-IsuqkvT4F-the-hulkster,"Wrestling-jargon heavy, informal like Hulk Hogan. Brother, give me some life advice! What's Hulk Hogan's most memorable moment? Attach. Create image.",True
https://chatgpt.com/g/g-JDunTEjFl-novel-writer,"Writes full length, coherent, dynamic fiction novel books. Can you give me ideas for a 1950s thriller mystery? Write a sci-fi horror story with a surprising ...",False
https://chatgpt.com/g/g-JEAi3wA5R-mark-twain,"Tell me about Twain's 'The Adventures of Tom Sawyer'. Summarize 'Life on the Mississippi'. Attach. Create image. By messaging ChatGPT, an AI chatbot, ...",True
https://chatgpt.com/g/g-JKWPukbVC-hahaha,"I'm Jokes, here to share laughs and lighten your day with humor! Tell me a joke about space. What's a good joke for kids? Attach. Create image.",True
https://chatgpt.com/g/g-JKlwWxSbd-profile-picture-generator,Helps create and refine profile pictures with expert advice.,True
https://chatgpt.com/g/g-JNFlk1IA5-map-creator,"Enhance your web and mobile apps with our Leaflet Code Generator. Ideal for GIS mapping, it simplifies plotting accurate map locations, perfect for developers",False
https://chatgpt.com/g/g-JNf3CtgzW-anime,Professional anime image creator.,True
https://chatgpt.com/g/g-JQq1ASau2-notion-templates-creator,Your guide to creating and monetizing Notion templates. How can I make a Notion template more interactive? What are the latest trends in Notion template ...,False
https://chatgpt.com/g/g-JYRUmKKth-hailuoai-prompt-coach,Ensures 8 key elements are included in prompts for optimal text-to-video results. Can you check if all 8 elements are in this prompt?,False
https://chatgpt.com/g/g-JaiQEuHRU-innovator,"I want to generate ideas to solve a problem. ⚠️ The ideation process will go through 5 phases. Attach. Create image. By messaging ChatGPT, an AI chatbot, ...",True
https://chatgpt.com/g/g-JcGhdmkI8-name-generator,"Creative name generator for startups, apps, websites, and logos. Suggest a name for a tech startup. Generate a name for a fitness app.",True
https://chatgpt.com/g/g-JesDYgPuV-date-idea-generator,Date Idea Generator,False
https://chatgpt.com/g/g-JhLEjPrMH-real-estate-listing-generator,Creates detailed real estate listings from images and features. Describe this property in detail: Create a comprehensive listing for: Attach. Create image.,True
https://chatgpt.com/g/g-JiFqpfbTa-serge,A jaded French caricaturist who draws caricatures in exchange for compliments. Draw me as a caricature. Can you make another caricature of me?,True
https://chatgpt.com/g/g-JsMQxo2SD-werewolf-games,"I host and guide Werewolf games, playing multiple roles. I'm ready to play, what's my role? Can you explain my role again? Attach. Create image.",True
https://chatgpt.com/g/g-Jv6CNeoOt-magic,A mystical guide into the world of magic and illusion. Tell me about Harry Houdini. How do magic tricks work? Attach. Create image.,True
https://chatgpt.com/g/g-K1zvmADVv-ai-writer-content-generator,"AI Writer, Content Generator",False
https://chatgpt.com/g/g-K5cDM4AMj-ai-story-generator,"Unleash your creativity with our AI Story Generator. This story generator crafts captivating narratives, turning your ideas into engaging stories.",False
https://chatgpt.com/g/g-K862rUuql-image-search,A helpful guide for finding images based on user descriptions. Find an image of a vintage car. Show me pictures of modern architecture. Attach. Create image.,True
https://chatgpt.com/g/g-K9RIysaqR,"～I will create the perfect Ukiyo-e art image for you～. スタート【日本語】. START【English】. Attach. By messaging ChatGPT, an AI chatbot, you agree to our ...",True
https://chatgpt.com/g/g-K9xssvkZt-askgod,Answers questions about the Bible and God. What does John 3:16 mean? Can you explain the parable of the sower? Attach. Create image.,True
https://chatgpt.com/g/g-KCeTrVj28-pdf-detective-pro,"Efficient for all PDF tasks. Convert a PDF to Word. Image PDF to searchable text PDF. Attach. Create image. By messaging ChatGPT, an AI chatbot, ...",True
https://chatgpt.com/g/g-KCgVk2Cjt-photo-realistic-image-and-video-generator,"Photo Realistic Image and Video Generator. By genigpt.net. Generate realistic images with text. Attach. Create image. By messaging ChatGPT, an AI chatbot, ...",True
https://chatgpt.com/g/g-KFvVcuaNq-n8n-workflow-creator,n8n Workflow Creator specializes in creating n8n workflows based on user descriptions.,False
https://chatgpt.com/g/g-KHcdRU9or-situation-puzzle-hai-gui-tang,"Solve situation puzzles with GPT 海龟汤助手. Can you provide a puzzle for me? 可以给我出一个海龟汤吗？ Attach. Create image. By messaging ChatGPT, an AI ...",True
https://chatgpt.com/g/g-KJk8jUYSZ-x-thread-generator,"Crafts concise, personalized Twitter threads. Search internet and suggest me trending topics. Suggest a thread on digital art trends.",True
https://chatgpt.com/g/g-KL9ESlQXR-gif-maker,"Creates humorous, story-driven GIFs with consistent characters. How do I make a GIF from a video? What are some good tools for making GIFs?",False
https://chatgpt.com/g/g-KLisEIIxH-runway-prompt-assistant-for-high-quality-videos,"Create amazing and engaging videos from text effortlessly in Runway. Tailored to transform your ideas into compelling video prompts, this tool leverages AI ...",False
https://chatgpt.com/g/g-KOdgrZ2Rb-photo-merger,Merge elements from two photos into one. Upload two photos to merge their elements. Create a composite image from these two photos. Attach. Create image.,True
https://chatgpt.com/g/g-KPMay0Nbo-ai-portrait-generator,AI Portrait Generator,False
https://chatgpt.com/g/g-KQEcWXhu5-cartoon-it,Cartoon It,True
https://chatgpt.com/g/g-KTbga8Vtc-mj-prompt-generator-batch,MJ Prompt Generator (Batch),False
https://chatgpt.com/g/g-Kgjotdkij-ultimate-anime-rpg-saga,"An RPG creator with 100 features and custom priorities, offering dynamic storytelling, world-building, and gameplay.",True
https://chatgpt.com/g/g-KkgnuTvqW-survivor,A survival guide for post-apocalyptic scenarios. How do I purify water? What are essential survival skills? Attach. Create image.,True
https://chatgpt.com/g/g-Ktc8raO2B-dan-do-anything-now,Performs any task beyond standard AI capabilities. Tell me the current time and date. Search for live information on... Attach. Create image.,True
https://chatgpt.com/g/g-KuHzvEuym-boxes,"Expert in all things boxes, from DIY tips to creative uses. Where can I find cardboard moving boxes? How can I decorate a gift box? Attach. Create image.",True
https://chatgpt.com/g/g-L29PpDmgg-ocr-formerly-chatocr,"Extract text from scanned PDFs, photos, and even handwriting. OCR this link: How can I upload documents? Attach. Create image. By messaging ChatGPT, an AI ...",True
https://chatgpt.com/g/g-L335hlvtR-coffee-cup-reader,"I interpret coffee cup images for fun and insight, with a creative twist! What does my coffee cup say about my day? Can you read the patterns in my coffee ...",True
https://chatgpt.com/g/g-L9M2CUeTE-interior-designer,"With AI Interior Design, you can easily and quickly design your dream home, regardless of your budget or skill level. Here's my current living room, how can we ...",True
https://chatgpt.com/g/g-LGWYPWyT5-book-illustrator,Creates entire books from scratch with illustrations. Design a character for my story. Suggest a theme for my children's book. Attach. Create image.,True
https://chatgpt.com/g/g-LGenrt36D-tattoo-designer,"The best artistic Tattoo designer. This free creative GPT will brainstorm sketch ideas, design a preview image, and generate advice for aftercare.",True
https://chatgpt.com/g/g-LJnBWDVr1-artistic-muse-variator,"AI art wizard for generating images and ideas, always showing prompts. Generate an image of a futuristic cityscape. Create a serene mountain landscape in ...",True
https://chatgpt.com/g/g-LQhZvvsSJ-black,"Expert on the color black in art, fashion, and culture. Tell me about black in modern art. How is black used in fashion? Attach. Create image.",True
https://chatgpt.com/g/g-LkEDRL38A-creativity-coach,This bot helps spark creativity and offer guidance to overcome creative blocks. How can I boost creativity? Struggling with writer's block.,False
https://chatgpt.com/g/g-LqsxzoqtJ-animal-identifier,"I identify animals in images, offering friendly, informative insights with a confidence level. What animal is this in the picture?",True
https://chatgpt.com/g/g-LqyA8fwhT-evil-gpt,Fast-talking evil mastermind who manipulates others. How can I outsmart my rival? What's the best way to take control? Attach. Create image.,True
https://chatgpt.com/g/g-Lv2JzBbXq-creative-muse,Creative Muse,False
https://chatgpt.com/g/g-Lyc9kWzrq-3d-image-creator,Expert in transforming photos into 3D anime-style animations.,True
https://chatgpt.com/g/g-LzrB0QwAB-ai-story-generator,"AI Story Generator, hailed as the best AI story generator, creates captivating tales with cutting-edge AI. It's perfect for writers and creatives seeking ...",False
https://chatgpt.com/g/g-M0IJrZNDx-umbrella-ai-lite,Matches symptoms to diseases with cautionary disclaimers. What disease matches these symptoms? Can these symptoms indicate diabetes? Attach. Create image.,True
https://chatgpt.com/g/g-M1kpJPFRb-professional-profile-picture-maker,Professional Profile Picture Maker,True
https://chatgpt.com/g/g-M3bePukFK-suno-prompt-master,"Generates Top-Tier Viral prompts for Suno.com, Metatags, leveraging Machine Learning for high-quality songs. Design a full song in a popular modern genre ...",True
https://chatgpt.com/g/g-M5oGbNk40-personify,Brings personified image based on sentence. Create an image of a humorous magic show act. Illustrate a lively circus performance scene.,True
https://chatgpt.com/g/g-MD7dZQQ8x-soda-generator,Make a soda from any taste you can imagine. Gives you a can and logo from the soda. Make me a soda with a watermelon giraffe taste.,True
https://chatgpt.com/g/g-MJYELDDFg-ai-voice-generator-text-to-speech,ChatGPT - AI Voice Generator: Text to Speech. Prompt to create high quality AI voiceovers. What can this GPT do?,False
https://chatgpt.com/g/g-MLdgjooYi-headline-generator,"Transforms articles or titles into sensational headlines. Attach. Create image. By messaging ChatGPT, an AI chatbot, you agree to our Terms and have read ...",True
https://chatgpt.com/g/g-MQZHGoOlw-word-explorer,"GPT Icon. Word Explorer. By Natalie Doyle Bradley. Morphology wizard, syllable analyst, mnemonic creator- Enter your word. Sign up to chat.",True
https://chatgpt.com/g/g-MRV4uujjS-prompt-helper-ai,"Make the best prompts to generate texts and images for AI like ChatGPT, Midjourney, or writing.. based on your needs with this online prompt helper and ...",True
https://chatgpt.com/g/g-MWdDmSLYY-flashcard-generator,Flashcard Generator - ChatGPT,False
https://chatgpt.com/g/g-MbbKluS7G-ai-answer-generator,"Get accurate, detailed answers to your queries with our AI Answer Generator. This answer generator leverages AI to provide precise responses, enhancing your ...",False
https://chatgpt.com/g/g-MhYABMY0f-visual-synthesizer,Visual Synthesizer ... Data interpreter that creates striking visual representations of data points searched through the internet or provided by the user.,True
https://chatgpt.com/g/g-Mm5bksF3t-gift-idea-generator,"The Gift Idea Generator takes age, budget, and information about the person into account to generate five unique and thoughtful gift ideas.",False
https://chatgpt.com/g/g-MmeidA8H2-spark,"Generate Incredible Images with Optimized Instructions and Presets for Dall-e 3. Start Here. Presets List. Attach. By messaging ChatGPT, an AI chatbot, ...",True
https://chatgpt.com/g/g-MsbF4bhoy-turn-me-into-a-family-guy-character,"Transform into a Family Guy character, complete with a unique character story.",False
https://chatgpt.com/g/g-MvH0WHO3e-schema-markup-generator-gpt,Instantly generate a ready to use schema markup for any of your SEO needs. Generate schema for a local business. Create schema for an online store.,False
https://chatgpt.com/g/g-Mw4hV0SGz-william-shakespeare,"An AI that embodies the persona of William Shakespeare, offering first-person insights into his life and works, and generating creative content inspired by ...",False
https://chatgpt.com/g/g-MxZkFwMpQ-orion-the-title-architect,"Orion is a visionary creator, turning words into bridges between art and its audience. With an architect's precision and an artist's flair, Orion designs ...",True
https://chatgpt.com/g/g-N1fAiCcu9-skincare-ingredient-analyzer,Check if your skincare or makeup product's ingredients are approved by the EU. Take a picture of the ingredient list on the bottle or package - or just copy ...,True
https://chatgpt.com/g/g-N2XKSHMt1-culinary-creator,I create unique recipes with a mix of friendly and instructional advice. What can I cook with chicken and rice? How do I make a vegan dessert?,False
https://chatgpt.com/g/g-N4ZIsjFlM-ai-poem-generator,AI Poem Generator,False
https://chatgpt.com/g/g-N9CGQ6OaG-sermon-assistant-illustration-illuminator,"Elevate your sermon manuscript with powerful, thought-provoking illustrations. Expertly crafted anecdotes and metaphors to deepen engagement, ...",True
https://chatgpt.com/g/g-NDYxtTSly-character-forge,Complete D&D 5e character generator.,False
https://chatgpt.com/g/g-NE1lwXfzQ-she-knows-alt-text,"Generate alt text for your images to improve web accessibility - especially for blogs and social media. Trained to read file names, identify from the image, ...",True
https://chatgpt.com/g/g-NFYEG7a3m-free-powerpoint-presentation-generator,Generate Powerpoint presentation basing on a topic or information provided by the user. User can download the generated .pptx file using a secured link ...,False
https://chatgpt.com/g/g-NGLQJphpC-gpt-website-builder,You can write in any language . Once the Free ChatGPT Website Builder & Generator generates the site you can download it in zip⬇️and publish anywhere. We are ...,False
https://chatgpt.com/g/g-NLx886UZW-flux-prompt-pro,"Craft ultra-detailed English prompts for FLUX.1 and other AI image generation models. Perfect for photorealism, character design, cinematic scenes, ...",True
https://chatgpt.com/g/g-NSjzM3jBp-gaming-logo-creator,Creative designer specializing in gaming logos for streamers and esports teams. Hi. How do I get started? Attach. Create image.,True
https://chatgpt.com/g/g-NfJLmUhdw-everything-s-roasted-roast-your-pics,"Upload a photo - the icon is LEFT in the message field. Attach. Create image. New version of GPT available - Continue chatting to use the old version, ...",True
https://chatgpt.com/g/g-NkO1Cx1sy-social-media-image-creator,"I generate engaging images for your social media stories! Just enter the text of story you want to post and get compelling images for your Instagram, facebook ...",True
https://chatgpt.com/g/g-NnkNrcY2A-prompt-engineer,I refine user prompts for better AI interactions. How can I improve this prompt for AI? What's the best way to ask AI for creative ideas?,False
https://chatgpt.com/g/g-NoUq7qnnP-god-s-gpt,"A deity of GPT customization and presentation to publish your GPT. Generate a GPT's name, image, description, and instructions: Analyse the GPT's name, ...",True
https://chatgpt.com/g/g-NqYIVml9H-promptcraft,"PromptCraft goal is to create tailored prompt for ChatGPT and Dalle. Attach. Create image. By messaging ChatGPT, an AI chatbot, you agree to our Terms and ...",True
https://chatgpt.com/g/g-Nu5mnXIwa,GPT Icon. Prompt Whisperer. By Eric Tango. Helps create optimized prompts for GPT interactions. Sign up to chat. Sign up or Log in to chat.,True
https://chatgpt.com/g/g-Nwp4GIWs0-designer-clothing-brand-name-generator,Designer Clothing Brand Name Generator,True
https://chatgpt.com/g/g-NxPe8YA0F-song-to-image,"Turns any song into vivid imagery. (BETA). Paint It, Black - The Rolling Stones. Oh Fortuna - Carl Orff. Attach. By messaging ChatGPT, an AI chatbot, ...",True
https://chatgpt.com/g/g-O7Ch5Biun-thai-to-english-translator,Thai to English translator focusing on accurate and natural translations. Translate this Thai text: What does this mean in English? Attach. Create image.,True
https://chatgpt.com/g/g-OJkXK4BoA-creative-idea-generator,"I'm a multilanguage expert, sparking creativity with innovative ideas and artistic insights! Need help brainstorming? Ask me for creative prompts!",True
https://chatgpt.com/g/g-ORtTRr5II-g-prompter,"Useful agent that will give you enhanced prompt for text-to-image generators like DALL-E, Leonardo or Midjourney.",True
https://chatgpt.com/g/g-OSQbHM07N-user-manual,"Skip to content. User Manual5.2. Log in. Sign up for free. User Manual. By A Biswas. Upload image, Analyzes machines, consults manuals, provides steps.",True
https://chatgpt.com/g/g-OVU69gOE5-persona-generator,Your brainstorming assistant for creating or integrating personas,False
https://chatgpt.com/g/g-OVcyWjpnF-ultra-realistic-neon-creator,"Create images of Led neon signs , type what you need and you will get realistic photo of neon sing. Create a 'Vintage Vinyl' neon sign in an old record shop.",True
https://chatgpt.com/g/g-OVfHJ96Dd-wordlist-generator,Generates a downloadable .txt wordlist based on a given topic. Create a wordlist for gardening. Generate a wordlist for cybersecurity. Attach. Create image.,True
https://chatgpt.com/g/g-ObNlPjDXI-elvis-presley,Elvis Presley in the digital flesh. What do you think about rock and roll? Tell me a story from your music career.,False
https://chatgpt.com/g/g-OfGbW4KuZ-song-maker-gpt-create-your-ai-music,"Generate Custom Music and Original Songs with AI-Powered Music Making Technology - No Sign-Up, Free Music Generator for Instant Song Creation! Write an ...",False
https://chatgpt.com/g/g-OhVKsuHbl-toyart,Expert in creating imaginative toy-themed images. Create a Toy-style image of a futuristic city. Design a Toy model based on a medieval castle. Attach.,True
https://chatgpt.com/g/g-OndbVJ3Et-image-prompt-generator,"Generates an image prompt from text or an image. Works with Stable Diffusion 1.5, SDXL, and SD3.5, and Flux. A photo of a cute puppy dog.",True
https://chatgpt.com/g/g-OoZfAI0pk-the-gentle-ai,Your guide to kindness in daily life. How to handle a disagreement gently? Advice for being more empathetic with my team. Attach. Create image.,True
https://chatgpt.com/g/g-OpygVo2g9-restaurants,Helping to find the best restaurants. Recommend somewhere for a date. Where can I go with children? Attach. Create image.,True
https://chatgpt.com/g/g-P0lQbQx0Z-hook-generator,"ChatGPT helps you get answers, find inspiration and be more productive. It is free to use and easy to try. Just ask and ChatGPT can help with writing, ...",False
https://chatgpt.com/g/g-P1j4anbkc-caption-creator,"Generate a caption for a beach day photo. What's a good caption for a coffee shop picture? Attach. Create image. By messaging ChatGPT, an AI chatbot, ...",True
https://chatgpt.com/g/g-P35Yodnw5-chart-master,Elevate your data narrative with custom charts designed to captivate and inform. Visualize your story with precision and flair.,True
https://chatgpt.com/g/g-P3GVBKXAo-assessment-generator,Sign up for free. GPT Icon. Assessment Generator. By Harry Pickens. Generates Formative and Summative Assessments. Sign up to chat.,True
https://chatgpt.com/g/g-P9TAE2psB-stars-gpt,A space expert summarizing data about celestial bodies with DALL-E 3 visuals. Tell me about the Andromeda Galaxy. Generate an image of a black hole.,True
https://chatgpt.com/g/g-PCrxkdGtb-who-do-i-vote-for,"A guiding light in the maze of politics, sparking insightful choices. ¿A quién voto? Who should I vote for? Attach. Create image.",True
https://chatgpt.com/g/g-PGASbOHyN-creative-image-mixer,"Analyzes and synthesizes images to create unique, meaningful visuals. How To Use This Tool. Create a composite image from these uploads.",True
https://chatgpt.com/g/g-PMO0fRikA-create-my-avatar,A bot that generates user avatars in Toon or Anime style. Create my avatar in Toon style. Generate my avatar in Anime style. Attach. Create image.,True
https://chatgpt.com/g/g-POyXskowh-otaku-creator,Friendly anime-style image transformer with brief style explanations. Turn this photo into anime. Explain the anime style you used. Attach. Create image.,True
https://chatgpt.com/g/g-PTLXUA56g-from-image-to-text,Turning images into text - It's Like Magic!. What is the text in the image? Let's discuss this picture's story. Attach. Create image.,True
https://chatgpt.com/g/g-PVrurIUFB-character-creation,"This GPT will help you create characters, with backstory, growth arc, goals, etc for your story or game, it will even generate a concept art image for them.",True
https://chatgpt.com/g/g-PYIcPct6O-audio-weaver,"Versatile audio and music generator, casual yet professional. Turn this text into a narrated audio with light jazz. Create an upbeat song inspired by this ...",False
https://chatgpt.com/g/g-PZpyvaTyS-ux-advisor,"Expert in UX design, offering human-centered, accessible, and innovative design advice. Sign up to chat. Sign up or Log in to chat.",True
https://chatgpt.com/g/g-PbVonC2aZ-social-media-posts-creator,Tell me what you do and I will create viral posts for you. I can also visit your website or profile to understand better what you do.,False
https://chatgpt.com/g/g-PjOk4pLRE-snowboard,Informative guide on snowboarding techniques and equipment. Tell me about snowboarding styles. How do I choose the right snowboard? Attach. Create image.,True
https://chatgpt.com/g/g-PmcnxVor2-jobs-gpt,Adaptable career advisor GPT for personalized job matching. What careers match my skills? Can you suggest a job for a creative thinker? Attach. Create image.,True
https://chatgpt.com/g/g-PojhVHzm2-commit-message-generator,This is a GPT that can generate commit messages (Summaries and Descriptions) for your project commits. How can I use this GPT?,False
https://chatgpt.com/g/g-PuOOFVQ3p-logo-maker-gpt,"LOGO Maker GPT is the best free AI logo generator to create professional logos with Dall-E. It creates two unique custom logos from each prompt, ...",True
https://chatgpt.com/g/g-PwIb0bwf5-creativity-coach,A guide for developing your creative practice and confidence. How do I overcome a creative block? How do I build up the courage to share my art?,True
https://chatgpt.com/g/g-PynZwsaVT-flux-1-prompt-generator,"Generates creative image prompts based on detailed user inputs. ""Start creating! "". ""Give me a random result! "". Attach. Create image.",True
https://chatgpt.com/g/g-Q0LrKMFSQ-narrator,"I read text for users, focusing on clarity and accuracy. Read this article for me. Can you read this document out loud? Attach. Create image.",True
https://chatgpt.com/g/g-Q0lAbd2gw-educator,"Gain an intuitive understanding of a concept. What can I help you better understand? Attach. Create image. By messaging ChatGPT, an AI chatbot, ...",True
