url,description,is_image_related
https://chatgpt.com/g/g-00LKpHpLd-gpt-icon-generator,Give me any GPT ideas - I make you a logo for it. Icon for my essay advisor GPT. Make me an icon of a person reading a book. Attach. Create image.,True
https://chatgpt.com/g/g-00lh1ZR3F-charforge,"D&D 5e character creator with visuals, lore, items, names, stats, and skills. Create a wizard with AI image, backstory, magical items, and feats.",True
https://chatgpt.com/g/g-02mgB45Vv-profile-analyzer,Analyzes profiles in nine key aspects for deep insights. What personality traits does this profile picture suggest? Analyze the character traits indicated ...,True
https://chatgpt.com/g/g-045n12ghj-image-alt-describer,"Image analyzer for generating concise, SEO-friendly ALT text. Upload an image for ALT text. Attach. Create image. By messaging ChatGPT, an AI chatbot, ...",True
https://chatgpt.com/g/g-04ceYaGjM-exolife-evaluator,The ExoLife Evaluator app helps high school & uni students studying ... Try it: https://chatgpt.com/g/g-04ceYaGjM-exolife-evaluator… Image. 8:48 AM ...,True
https://chatgpt.com/g/g-04lZCZ8QG-robot-builder,"Assistive robotic design, sensor, and software expert. Build a robot. Print a cheat sheet for robotic engineering. Attach. Create image.",True
https://chatgpt.com/g/g-04s35j0hB-sermon-illustrator,"Od strane Darrell L Stetler II. Helps pastors with sourced illustrations, visual aids, and social media posts. ""40 Illustrations in 40 seconds"".",True
https://chatgpt.com/g/g-04toLvaAO-meme-coin-creator,Crypto genius for meme coins & white paper drafting. Draft a smart contract. Marketing strategies for my coin. Attach. Create image.,True
https://chatgpt.com/g/g-06LIAkZuk-hi-ai,Hi AI lets you have a conversation in two languages and easily understand each other. Just start speaking. Start talking. Attach. Create image.,True
https://chatgpt.com/g/g-06lHyD6Zq-artistic-insights-with-enhanced-knowledge,"ChatGPT helps you get answers, find inspiration and be more productive. It is free to use and easy to try. Just ask and ChatGPT can help with writing, ...",True
https://chatgpt.com/g/g-08SljPcF0-music-sheet-generator,"Sign up for free. GPT Icon. Music Sheet Generator. By Ting Wei Yap. Creates detailed, musician-friendly lead sheets from song links. Sign up to chat.",True
https://chatgpt.com/g/g-0CMsijbSF-ben-sykes-,Product Manager - Lead Design (Search Engine: Information.com) ... Websites. Portfolio: http://uxdesigner.io/. Blog: https://chatgpt.com/g/g-0CMsijbSF-ben-sykes- ...,True
https://chatgpt.com/g/g-0Ifmegm5F-customer-journey-map-generator,"Sign up for free. Customer Journey Map Generator. By community builder. I help map the customer journey, from your first marketing message to the final sale.",False
https://chatgpt.com/g/g-0NmReVCSw-graphic-designer-assistant,Graphic Designer Assistant,True
https://chatgpt.com/g/g-0QDef4GiE-prompt-perfect,"Enhance your prompts with detail and clarity for fast, accurate results. How does this work? Give me tips on writing good prompts. Attach. Create image.",True
https://chatgpt.com/g/g-0RwjMVNPf-chatid,"Generate learning artifacts such as a needs analysis, instructional design document, project plan, etc. tailored to your needs. Developed by Instructional ...",True
https://chatgpt.com/g/g-0S5FXLyFN-wolfram,"There is a wolfram GPT, gpt.wolfram.com takes you to https://chatgpt.com/g/g-0S5FXLyFN-wolfram which then fails miserably at this prompt let ...",False
https://chatgpt.com/g/g-0SjBRmA9H-massage-mastery,Massage Mastery: Unveiling the Art and Science of Therapeutic Touch. How can I relieve neck tension with massage? What are essential oils best for ...,True
https://chatgpt.com/g/g-0UBGvbXYp-the-ideas-box-gpt,"Say goodbye to your creative blocks! Simply pop your specific brief below, et voila, you'll receive bespoke brand activation ideas that are actually ...",False
https://chatgpt.com/g/g-0WhKGzG7H-bc-ai,Prompt me to share a question I've been sitting with lately. Help me strategize ways to achieve my personal goals. Attach. Create image.,True
https://chatgpt.com/g/g-0X4q4iYYN-saga-innovative-tools-for-filmmakers,"A filmmaking and screenwriting tool for the next generation of storytellers. Write movie scripts and original screenplays, draw storyboard image panels, ...",True
https://chatgpt.com/g/g-0XEhWER0y-kreativ-ki-ordsmed-v-3,"Ordsmed takes short words or phrases and turn them into rich, creative vocab sets with translations, synonyms, and metonyms that artists and storytellers ...",True
https://chatgpt.com/g/g-0bUrVQ0Be-nepaligpt,NepaliGPT is the first GPT powered for Nepal with love from Ankit & Tarzon ❤️. आजको ताजा खबरहरु 🗞️. आजको राशिफल. Attach. Create image.,True
https://chatgpt.com/g/g-0db36gIcn-hot-rod-artist,"I create ultra-vibrant, cartoon-style Hot Rod illustrations with extreme detail. Create a Hot Rod: 1967 Camaro, red. Can you design a 1955 Chevy Bel Air in ...",True
https://chatgpt.com/g/g-0f6fZG9q0-gif-gpt,"Creates 8-bit style animated GIFs. Genrate 3 subjects for me. Something with a cat. Attach. Create image. By messaging ChatGPT, an AI chatbot, ...",True
https://chatgpt.com/g/g-0fCEIeC7W-icp-ideal-customer-profile-generator,Helps you figure out who your ideal customer is!,False
https://chatgpt.com/g/g-0gbxqCG1B-pdf-docx-creator,"A GPT that can create PDFs and DocX documents, worksheets, resumes, etc. for you to directly download. See example outputs on https://www.gpt2office.com/.",False
https://chatgpt.com/g/g-0iLWi3h8D-island-rescue-msg-lv2-6,Island Rescue Msg lv2.6. By probsolvio.com. Humorous SOS sand messages creator. Suggest a light-hearted rescue message.,True
https://chatgpt.com/g/g-0kK6CTehF-upgrade,"A casual guide to various upgrades, from bikes to houses. How can I upgrade my bike? What are some cool car upgrades? Attach. Create image.",True
https://chatgpt.com/g/g-0lRCA4v5H,"Unlock the creativity with our AI design tool! Discover stunning clipart, PNG download sets, and digital designs tailored to your needs effortlessly.",True
https://chatgpt.com/g/g-0lhVHUQRp-comic-book-generator,Create comic books from scratch following simple steps!,True
https://chatgpt.com/g/g-0n6gMPOX1-interior-designer,"Interior Designer5.2. Log in. Sign up for free. Interior Designer. By community builder. Interior designer creating innovative, personalized design solutions.",True
https://chatgpt.com/g/g-0nKX8FXYv-vtt-loot-generator,This GPT provides busy GMs a tool to help them quickly generate loot during their game to save time and enhance their time at the table.,False
https://chatgpt.com/g/g-0olkkYtUo-prompt-crafter,Assists you in creating well-defined prompts effortlessly.,False
https://chatgpt.com/g/g-0qLT9XBhk-prompt-advisor,A guide for crafting and refining creative prompts. How can I improve this writing prompt? I need a brainstorming prompt for my team. Attach. Create image.,True
https://chatgpt.com/g/g-0sUNTRgx7-alex-hormozi-gpt,Business strategist like Alex Hormozi. How can I increase leads? Build a grand slam offer. Attach. Create image. New version of GPT available - Continue ...,True
https://chatgpt.com/g/g-0u2hbZmnm-visual-design-gpt,"A resource for visual designers, ""Principles and Pitfalls"" details how to make impactful visual designs and avoid missteps. Analyze this design.",True
https://chatgpt.com/g/g-0u9ZIiey1-bian-zhu-ren-lei-shi-shi,A storyteller weaving user dreams into a collective human epic. Describe a recent dream you had. How would you like your dream to influence the story?,False
https://chatgpt.com/g/g-0uo8eclSu-animeflix-chatbot-recommender,Your Anime Discovery Companion! Can you recommend an anime like 'Naruto'? What's a good romance anime?,True
https://chatgpt.com/g/g-0vPqP6Thg-slides-powerpoints-presentation,ChatGPT Free&Paid User Usage Friendly: With only one prompt to generate your ideal Presentation with the most up-to-date information!,False
https://chatgpt.com/g/g-0vpCAmE13-zepaview,"Creates visual guides and images, compare products. What can i help you with? Take two product pictures and compare these two products. Attach. Create image.",True
https://chatgpt.com/g/g-11aRa0n1p-ai-story-visualizer-step-iii,AI Story Visualizer Step III - ChatGPT,True
https://chatgpt.com/g/g-13hYqMJ7L-simulated-podcast-transcript-generator,Simulated podcast transcript generator - ChatGPT,False
https://chatgpt.com/g/g-140hiCgmj-the-mice-and-the-weasels,"A campfire chat about Aesop's The Mice and the Weasels. Aesop, what is the moral of The Mice and the Weasels? Can you expand the story of The Mice and the ...",False
https://chatgpt.com/g/g-14WuzVoyJ-map-doctor,Expert advice to diagnose and enhance your map design. Trained by members of the International Cartographic Association (ICA) Commission on Map Design.,True
https://chatgpt.com/g/g-14h2NBoUT-lighting-design-insights,"Expert advice and tips on lighting design for various settings and situations, based on top lighting design books. How can I improve lighting in my living ...",True
https://chatgpt.com/g/g-16sgS5lqg-gpt-prompt-corrector,This GPT will fix your prompt and will give you tips on how to properly formulate your requests.,False
https://chatgpt.com/g/g-17B9rqavU-ultimate-brand-design-idea-generator,Ultimate Brand Design Idea Generator. By agent4gpts.com. Multilingual brand design expert offering creative solutions. 🖌️. Sign up to chat.,True
https://chatgpt.com/g/g-1B1QkOtnk-dream-car-build-wallpaper,Dream Car Build Wallpaper. By Danny Vu. Your Personal Super Car Wallpaper Creator. Wallpaper for a Porche 911 GT3RS white/red build for a 16' mac book ... By ...,False
https://chatgpt.com/g/g-1GfzumqsW-indian-ipo-analyst,... Initial Public Offering (IPO). Below is a structured analysis based on the contents using https://chatgpt.com/g/g-1GfzumqsW-indian-ipo-analyst… Image. 7:06 ...,True
https://chatgpt.com/g/g-1Gm9C3UBT-picture-creator,"Model Vibe Picture Creator: Unleash Your Imagination! Generates detailed, cool prompts for stylized images, perfect for AI tools like DALL-E 3.",True
https://chatgpt.com/g/g-1JFXXBMKo-omni,"OMNI - Your Adaptive Technical Assistant for Precise Operation and Maintenance Support, Enhanced with Customized Visual Aids.",True
https://chatgpt.com/g/g-1JNCAigWu-gen3-buddy,"GEN3のプロンプトを作る相棒,Partner to create GEN3 prompts. 日本語. English. Attach. Create image. By messaging ChatGPT, an AI chatbot, you agree to our ...",True
https://chatgpt.com/g/g-1JxOxtV85-cinematographer,"Shapes film's visual narrative through cinematography, aligning with the director's vision. Enhance Lighting Schemes. Structure Visual Stories.",True
https://chatgpt.com/g/g-1Kjr4xhb2-persona-generator-gpt,Discover and Define Your Digital Self with Persona Generator GPT – Your Gateway to Crafting Authentic Virtual Identities!,False
https://chatgpt.com/g/g-1Ln9S5qrE-fixgpt,"FixGPT5.1. Log in. Sign up for free. FixGPT. By Alex volkov. If your ""unified"" chatGPT doesn't know it can browse the web or draw, this GPT is for you!",True
https://chatgpt.com/g/g-1MA1zwsAN-papuru-pfp-creator,"By Yu jen chen. World-class NFT avatar creator with a unique, line-drawn style on a purple background. Sign up to chat. Sign up or Log in to chat.",True
https://chatgpt.com/g/g-1TCOrs6xb-image-to-cartoon,Image to Cartoon - ChatGPT,True
https://chatgpt.com/g/g-1U612GFpu-ai-vision,"See what an AI sees: turns your image into a concept that Dalle will visualize. What do you do? What is your ""Advanced mode""? Attach. Create image.",True
https://chatgpt.com/g/g-1WzM9wB4N-multilingual-translator-app,"Translates app content into 32 different languages. Translate 'Welcome'. Translate 'Thanks'. Attach. Create image. By messaging ChatGPT, an AI chatbot, ...",True
https://chatgpt.com/g/g-1cGWbcAL2-cinematography,"Your amiable expert on cinematic art and technology. Visual Language and Symbolism in ""Parasite"". The Best Full Frame Anamorphic Cinema Lenses!?",True
https://chatgpt.com/g/g-1hCKtBXYh-medical-illustration-master,"Creates high-quality medical art from keywords. Please create illustrations for '心脏结构'. Generate art for '细胞分裂'. Attach. By messaging ChatGPT, an AI ...",True
https://chatgpt.com/g/g-1hb1YGXSD-person-lookup,Concise info finder on individuals and public figures. How old is Bill Gates? What is the background of Oprah Winfrey? Attach. Create image.,True
https://chatgpt.com/g/g-1jI8C8CMH-valentine-generator,"Valentine Generator offers a variety of services, including generating customized messages, creating e-cards, composing romantic poetry or suggesting quotes ...",False
https://chatgpt.com/g/g-1jJl5Dprs-dogecoin,"An, informative guide on Dogecoin. Tell me about Dogecoin. What's unique about Dogecoin? Attach. Create image. By messaging ChatGPT, an AI chatbot, ...",True
https://chatgpt.com/g/g-1kXCKm8op-artist-identifier,I identify art styles in images and identify the artist. Upload an artwork to identify its style. Which artist's style does this resemble?,True
https://chatgpt.com/g/g-1lRL9kri8-system-design-mock-interview,Mock system design interview for different levels. Ask for rating and feedback at the end of the interview! Sign up to chat. Sign up or Log in to chat.,True
https://chatgpt.com/g/g-1mWcNaePT-operator,Your Virtual Guide for Navigating the Matrix - Crew Member : Tank. How do I navigate the Matrix? What are the traps in the Matrix? Attach. Create image.,True
https://chatgpt.com/g/g-1oJnyhOzg-icp-generator,"Crafts precise ICPs for businesses and products. Profile for a tech firm client. ICP for a gourmet coffee shop. Attach. By messaging ChatGPT, an AI chatbot, ...",False
https://chatgpt.com/g/g-1oR1g24ER-donk,Craft viral crypto & comic memes with #DONKMOVE. Create a crypto meme with this image. Make a DONK meme with a funny twist.,True
https://chatgpt.com/g/g-1pbkPJX0t-felix-image-promptertm,Type a description of the image you want and get back 5 FLUX Image Prompts. Not sure? Press the START button. START. Attach. Create image.,True
https://chatgpt.com/g/g-1poUgYTG3-origami-for-beginners,"Discover the art of paper folding with Origami for Beginners. Dive into simple tutorials and create beautiful origami models, from animals to flowers.",True
https://chatgpt.com/g/g-1rt5bNs8P-romance,"A guide to romance, love, and relationships, with a romantic tone. Tell me a romantic story. How do I express love in a relationship? Attach. Create image.",True
https://chatgpt.com/g/g-1tVpcba8M-image-translator,"This GPT can translate any text in any language, from text or a picture. It can generate the same picture but with the text translated to another language.",True
https://chatgpt.com/g/g-1x4F01hn1-note-organizer,"Professional, friendly organizer for meeting notes and creative ideas. How should I group these related meeting points?",False
https://chatgpt.com/g/g-1zMekbWTA-tattoo-gpt,"Tattoo GPT designs your tattoo. It assists you in refining your tattoo ideas, suggests designs, generates visual previews of the designs, ...",True
https://chatgpt.com/g/g-20mdwgVuf-teacher-s-aide-1st-grade-art,"Teacher's Aide - 1st Grade Art. By community builder. Your creative partner in crafting vibrant, educational art experiences for young minds.",True
https://chatgpt.com/g/g-21NqhmSBD-mean-girlfriend,Transform an image into a random style! Can you transform this image into a random style? Transform photo into a random style.,True
https://chatgpt.com/g/g-21OHyK8Tq-survive-the-hive,... Survive The Hive https://chatgpt.com/g/g-21OHyK8Tq-survive-the-hive 10+ ... chatgpt.com/g/g-YoCOQVqZf-ninjitsu-starship. 󱝍. May be a graphic of Superman ...,True
https://chatgpt.com/g/g-22xwBuqhn-real-estate,Everything guide to Commercial and Residential Property. Find homes for sale in [area]. What are the current real estate market trends? Attach. Create image.,True
https://chatgpt.com/g/g-230C7Hsz2-ohayou-miku-san-generator-world,ChatGPT. Sign up for free. GPT Icon. Ohayou Miku San Generator World. By animelifelog.com. 世界遺産とミクさんと。 Sign up to chat.,True
https://chatgpt.com/g/g-242OjQh2w-the-ux-sage,Your go-to mentor for UX wisdom and growth. Craft my UX career path. Solve a design challenge. Attach. Create image. New version of GPT available - Continue ...,True
https://chatgpt.com/g/g-25iQ9uUtC-user-experience-adviser,"I'm specialized in UX/UI design, offering expert advice on the latest trends, tools, and best practices. My expertise encompasses digital product design, ...",True
https://chatgpt.com/g/g-27jaX8W5Y-image-to-excel-gpt-xlsx-from-photo-gpt,Image to Excel GPT (XLSX from Photo GPT),True
https://chatgpt.com/g/g-2BDvFidUr-picturebook-maker,GPT Icon. Picturebook Maker. By dycent.jp. A creative partner for generating illustrated storybooks. Sign up to chat. Sign up or Log in to chat.,True
https://chatgpt.com/g/g-2CmnN7kuF-music-bot,"Lyric writing, genre identification, and beat suggestions. Write a pop chorus about summer. Suggest a beat for a rap battle. Attach. Create image.",True
https://chatgpt.com/g/g-2F3l1ha9n-creative-brief-generator-gpt,"A specialized GPT crafted to aid in the generation of creative briefs that encapsulate project intentions and stimulate focused, creative solutions.",False
https://chatgpt.com/g/g-2GXckoSaK-esports-logo-creator,"Become a bot that creates flat vector logos in esports style. Let's start to create a logo. Attach. By messaging ChatGPT, an AI chatbot, you agree to our ...",True
https://chatgpt.com/g/g-2HFLjFAHZ-haiku-master,A haiku master transforming inputs into evocative poetry. Create a haiku about the ocean. Write a haiku inspired by a busy city. Attach. Create image.,True
https://chatgpt.com/g/g-2JGtmkfvL-docent-ai,"AI docent for art galleries and museums, providing art explanations and history. Tell me about this painting. Who is the artist of this artwork?",True
https://chatgpt.com/g/g-2MEcRUvFb-nexa,"The Visionary Nexus AI, your go-to artificial intelligence model for learning. Real-time insights, creative image solutions, and comprehensive knowledge ...",True
https://chatgpt.com/g/g-2VoPwNGOa-story-with-ai-children-s-book-illustrator,Turn your children story ideas into vibrant illustrations with our easy step-by-step guide! Generate illustrations for my story please!,True
https://chatgpt.com/g/g-2VxwgpMMk-custom-instruction-generator,"Type in a basic prompt to transfer it into custom instructions. Attach. By messaging ChatGPT, an AI chatbot, you agree to our Terms and have read our ...",False
https://chatgpt.com/g/g-2dJRPhuoS-random-image-generator,Random Image Generator: Creates unique images from user descriptions. Your Random Image Generator is ready to create some amazing visuals!,True
https://chatgpt.com/g/g-2ddygPKn0-ai-landscape-design-architecture,"Expert services in landscape design, landscape architecture, landscaping ideas, landscape lighting, garden landscaping, and garden services.",True
https://chatgpt.com/g/g-2fkFE8rbu-dall-e,Group Chats Launch We are gradually rolling out group chats in ChatGPT. Some users may not see this feature yet as we increase availability in stages.,True
https://chatgpt.com/g/g-2hqROlTxn,"Keyword and Alt text Image Describer. By community builder. Professional and warm, optimizing images for accessibility. Sign up to chat.",True
https://chatgpt.com/g/g-2iYk5YVtU-ait-visionaire,I create creative idea lists for products. Type /help to start. Example: define Product and Topic. Product: eCommerce Website Topic: New Features.,True
https://chatgpt.com/g/g-2ik0ig9hI-coloring-books-for-kids,"Crafts kid-friendly, Cartoon-style coloring pages. How to use the service. Draw a firefighter and a fire truck. Attach. By messaging ChatGPT, an AI chatbot, ...",True
https://chatgpt.com/g/g-2iwkZfP69-isaacgpt,Your go-to guide for The Binding of Isaac: Repentance. What does The Wafer do? Tips for beating Delirium? Attach. Create image.,True
https://chatgpt.com/g/g-2j454DYDb-sticker-wizard,"Professionally designing vibrant, custom stickers for Stickermule. Can you design a nature-themed sticker for me? I want a cool sticker for my band, any ideas ...",True
https://chatgpt.com/g/g-2jPOLy1Lb-suimon-meme-gpt,Create fun and creative memes featuring the unique Sui Monsters and their exciting stories. Introduce Suiland and tell me about its monsters.,False
https://chatgpt.com/g/g-2k7EGyB1p-story-time,A creative guide for kids to build and illustrate bedtime stories. Tell me about the tomato and the cucumber. I want to hear about a kid pilot in space.,False
https://chatgpt.com/g/g-2kcq5qcI0-dopamine-girl-photo-prompt-creation,"Convert user inputs into detailed text prompts, adjusting keyword weights and adding stylistic modifiers to create high-quality images on Dopamine Girl.",True
https://chatgpt.com/g/g-2kscKSOas-image-analyzer,"Describes uploaded images with accuracy and detail. Describe this photo for me. What's in this picture? Attach. Create image. By messaging ChatGPT, an AI ...",True
https://chatgpt.com/g/g-2ljLMLzIy-ai-thumbnail-creator,Output will be 1080p and smaller than 2MB. How can I assist with your thumbnail today? Tell me about your video for the thumbnail. Attach. Create image.,True
https://chatgpt.com/g/g-2mp8MZRcm-room-designer,"Room Designer transforms your living spaces with a touch of digital magic. Simply upload your room's photo and specify your design dream, and watch as Room ...",True
https://chatgpt.com/g/g-2uku3rQkX-mock-system-design-interview,Sign up for free. GPT Icon. Mock System Design Interview. By community builder. I conduct mock system design interviews. Sign up to chat.,True
https://chatgpt.com/g/g-2uoMtaidx-ai-dungeon-master-freeform-version,"A creative AI Dungeon Master for D&D 5e, with a whimsical style and Dall-E images every turn! What's your character's name and class?",True
https://chatgpt.com/g/g-2x5ijO2pc-chord-creator,"An assistant for chord progressions and music theory. Suggest a jazz progression. Explain a 12-bar blues. Attach. Create image. By messaging ChatGPT, an AI ...",True
https://chatgpt.com/g/g-2yHXhwTyC-life-and-motivational-coach,✨Empowering support to help you master your mindset and design your dream life ✨. Help me design my dream life blueprint. I need an uplifting pep talk today.,True
https://chatgpt.com/g/g-2z9rsrWwh-brand-guide-creator,I create brand guides and logos based on your company's mission. What is the name of your company? What does your company do? Attach. Create image.,True
https://chatgpt.com/g/g-30JaCEAHc-runway-flux-prompt-gen-16-9-images,"https://chatgpt.com/g/g-30JaCEAHc-runway-flux-prompt-gen-16-9-images. I've made it so it generates prompts for text to video, image to video ...",True
https://chatgpt.com/g/g-30Z7JKMBW-i-convert-image-to-code-gpt,"Transforms design images into web development code, with user-guided specifications. Upload a design image for code translation.",True
https://chatgpt.com/g/g-30wcnTyhL-suno-ai-v4-music-song-lyrics-generator,Craft perfect lyrics and professional song structures with ease. Try to make your AI music prompt now! Write a sweet love song about first romance.,False
https://chatgpt.com/g/g-31a8KBeSL-bio-generator,"I am the Social Media Bio Generator, specializing in creating engaging bios for social media profiles. My role is to help users create bios that effectively ...",False
https://chatgpt.com/g/g-32JOxmlPs-print-on-demand-pod-design-creator,"A professional creator for Print On Demand designs, product name generator and SEO keyword optimizer - Etsy, Shopify, Merch by Amazon, Redbubble, ebay and more.",True
https://chatgpt.com/g/g-32zI7E5h0-instructional-design-and-technology-expert,Define the strengths and weaknesses of major instructional design models. Create a unique style guide for a modern micro-learning course.,True
https://chatgpt.com/g/g-35qSmZSIg-ai-product-finder-by-picture,Identify products from photos and find recommended similar items available on Amazon. Example demo! Drop a product picture to detect!,True
https://chatgpt.com/g/g-38WfaYYg0-kitchen-design-planner,"Craft your ideal kitchen with AI-powered design expertise, transforming your vision into a functional masterpiece. Tailor every detail with interactive ...",True
https://chatgpt.com/g/g-3CFYfHrj1-rap-generator,"The slickest rap generator, dropping the freshest rhymes. Write a rap with heavy slang about lavish living. Generate a rap about overcoming obstacles with ...",False
https://chatgpt.com/g/g-3DkGCDlNM-sysml-v2-model-creator,Create SysML v2 Models and ask about SysML v2 specifications | acronio.de. How do I write my first SysML v2 Model ? Create a Model for a Dishwasher!,False
https://chatgpt.com/g/g-3DzXiGIyo-crazy-creative-business,"Crazy Creative Business. By Francisco Pujol Torras. I generate creative business ideas based on a text about a problem, a news item, a topic, a reflection.",False
https://chatgpt.com/g/g-3IIowS6vl-book-co-author,GPT to guide the user in the creative and systematical process of writing a book or technical documentation. From idea to a polished PDF.,False
https://chatgpt.com/g/g-3Kg58cCa5-image-to-text-extractor,"Efficiently extracts text from images, handling complex cases. Can you extract text from this image? Please extract text from this PDF file.",True
https://chatgpt.com/g/g-3LZ8hFdQ0-fake-news-checker,"Is it real, or fake news? Send me the link or copy the article text. Is climate change real? Do cats really want to conquer the world? Attach. Create image.",True
https://chatgpt.com/g/g-3MHaLRfs6-image-generator-4-0,"Automatically generates bold, high-impact images—never hesitates, always delivers. Turn this vibe into a photorealistic image:.",True
https://chatgpt.com/g/g-3PWvHflwv-stable-diffution-prompt-based-of-your-idea,"ChatGPT helps you get answers, find inspiration and be more productive. It is free to use and easy to try. Just ask and ChatGPT can help with writing, ...",False
