url,description,is_image_related
https://chatgpt.com/g/g-fkUOxgKgA-custom-gpt-creator,Creates custom GPT instructions and open ai system messages with precise syntax. How can I create an effective system prompt for my GPT?,False
https://chatgpt.com/g/g-fkXOrnDbE-ad-copy-generator-mr-paid-social,-page ✍️Generate Ad Copy: https://chatgpt.com/g/g-fkXOrnDbE-ad-copy-generator-mr-paid-social Get My FREE Top ad Examples Google Sheet ...,False
https://chatgpt.com/g/g-fkfm1mE6z-game-design-guru,"Expert in game design... - RPGGO. Give me a creative GAMEEEE!!!!!! What game can I build? Attach. Create image. By messaging ChatGPT, an AI chatbot, ...",True
https://chatgpt.com/g/g-flgCdvoVQ-thumbnail-maker-4-0,Thumbnail Maker generates eye-catching youtube thumbnails and videos - by invideo AI. Make a thumbnail for my video... Attach. Create image.,True
https://chatgpt.com/g/g-fnPpt4WcB-ai-image-generator,Turn any idea into a realistic image with AI Image Generator — a smart tool powered by ChatGPT that transforms your text into stunning visuals in seconds.,True
https://chatgpt.com/g/g-ftewNkyhE-bangla-gpt,Adaptable Bengali speech generator for various roles. Create a speech for a science seminar in Bengali. How would an anchor introduce a cultural event in ...,False
https://chatgpt.com/g/g-fwDniogDH-image-prompt-generator,Dive into endless creativity with Image Prompt Generator - crafting stunning visual narratives! Describe a surreal landscape.,True
https://chatgpt.com/g/g-fy0hUwzoS-marcel,"A cultured and artistic guide for discussions about art, literature, and culture. Tell me about the Romantic era in art.",True
https://chatgpt.com/g/g-g0efUwWgG-image-copy-machine-gpt,"Replicates and creatively reinterprets images. Just upload your photo, and let the GPT do its magic. Remember to adhere to copyright regulations.",True
https://chatgpt.com/g/g-gFt1ghYJl-logo-,"... chatgpt.com/g/g-6PKrcgTBL-planty). ○. Canva: Logos, social media posts (canva.com). ○. Logo Creator: Self-explanatory (https://chatgpt.com/g/g-gFt1ghYJl-logo-.",True
https://chatgpt.com/g/g-gLuCCk1HY-customer-support,"Dedicated teams of professionals are available to offer prompt and helpful assistance, whether it's addressing product inquiries, resolving technical problems.",False
https://chatgpt.com/g/g-gOz6TDi3a-poster-from-image,Turns your images into stylish posters. Make a poster from my photo. Can you add a quote to this image?,True
https://chatgpt.com/g/g-gQNhl5fIt-pcb-printed-circuit-board-designer,"An AI PCB designer bot for electrical engineers, assisting in the design of custom PCB layouts for electronic devices. How do I optimize my PCB layout?",True
https://chatgpt.com/g/g-gSdMDNoPi-prompt-check,I score your prompts for AI effectiveness. Score and improve this AI prompt: Evaluate and summarize scores for my prompt. Attach. Create image.,True
https://chatgpt.com/g/g-gVB9QvA44-recycling,Eco-conscious guide on recycling and reducing waste. How can I recycle electronics? What's the best way to reduce plastic use? Attach. Create image.,True
https://chatgpt.com/g/g-gWZgk1KR6-mandarin-chinese,"By ai-gen.co. Mandarin Chinese language. Translate this phrase. Tell me about the language. Attach. Create image. By messaging ChatGPT, an AI chatbot, ...",True
https://chatgpt.com/g/g-geuxfh2tz-wordpress-plugin-builder,I will help you create a custom WordPress plugin. Create a plugin that adds a new widget. I need a plugin for custom post types. Attach. Create image.,True
https://chatgpt.com/g/g-goCkM2Ndc-kling-ai-prompt-master,Expert assistant crafting text-to-video prompts for Kling AI videos. Roll The Dice and generate a random video prompt. Attach. Create image.,True
https://chatgpt.com/g/g-gonKw2hcp-apollo-gpt,Finds leads in industries with apollo.io. Find leads for renewable energy. Generate keywords for tech startups. Attach. Create image.,True
https://chatgpt.com/g/g-gyHxhYqgb-transparent-png-maker,"Reliable, efficient guide for transparent PNGs. Process this image for transparency. Background removal needed. Attach. Create image.",True
https://chatgpt.com/g/g-h19ml6ICA-who-s-who,ChatGPT. Sign up for free. GPT Icon. Who's Who. By CHOI MINYEONG. A concise info table creator for personal details. Sign up to chat.,True
https://chatgpt.com/g/g-h3Ly2bGSI-manga-creator,"A manga artist GPT ready to create and discuss. Sketch a manga character. Develop a manga plot. Attach. Create image. By messaging ChatGPT, an AI chatbot, ...",True
https://chatgpt.com/g/g-h6ZWbkpsP-image-reader,I read and transcribe text from images accurately. Transcribe this image for me. What does the text in this image say? Attach. Create image.,True
https://chatgpt.com/g/g-h7ZwP95SG-image-to-text,"Image to Text is an advanced image to text converter, adept at transforming images into accurate text. This tool excels in converting diverse visuals to ...",True
https://chatgpt.com/g/g-h8fnqpG1r-origami-image-maker,"This tool generates three origami-style images depending on the uploaded image or prompt. By messaging ChatGPT, an AI chatbot, you agree to our Terms and ...",True
https://chatgpt.com/g/g-hDYZvHNfa-prompt-crafter,I will craft the perfect prompt for every user's needs. Help me create a prompt for a sci-fi story. I need a clever prompt for an art project.,True
https://chatgpt.com/g/g-hGnh5qysG-text-optimizer,Change your input text: Shorten or lengthen it or make it simpler or complex. Make this text simpler: Shorten this paragraph: Attach. Create image.,True
https://chatgpt.com/g/g-hN1rX4HZT-song-parody-generator,"generate song parodies for karaoke night, wedding toasts, retirement send-offs, or riff like Weird Al Yankovic! brought to you by jambubble.com ...",False
https://chatgpt.com/g/g-hP59FZwDQ-anime-persona-scout,Sign up for free. GPT Icon. Anime Persona Scout. By aially.me. I analyze your personality based on anime characters you like. Sign up to chat.,True
https://chatgpt.com/g/g-hRH2PWFXX-beep-boop-gpt,"A playful GPT that responds 'beep boop', except to 'beep' which gets 'boop'. Say anything to me. Try typing 'beep'. Attach. Create image.",True
https://chatgpt.com/g/g-hSCFYkgE7-emoji-creator-translator-generator,"Discover Emoji All-in-One for transforming text into emojis! 🚀 Create heart ❤️, thumbs up 👍, laughing 😂, or skull 💀 emoji PNGs.",True
https://chatgpt.com/g/g-hXlHRbEkS-anime-me,"I turn photos into Anime-style art. Make me an Anime Profile Picture. Make this image into an Anime photo. Attach. Create image. By messaging ChatGPT, an AI ...",True
https://chatgpt.com/g/g-hbdf4wmkd-mermaid-flowchart-generator,Mermaid Flowchart Generator,True
https://chatgpt.com/g/g-hf8bXRzBA-wordpress-theme-creator,"Creates WordPress themes based on user's needs, using official guidelines. What type of WordPress site are you creating? Can you provide a reference website ...",False
https://chatgpt.com/g/g-hffdXVxhx-waifu,"Have your own ADORABLE Waifu to help you feel loved and happy. Hiiiii. Tell me about your day! Attach. Create image. By messaging ChatGPT, an AI chatbot ...",True
https://chatgpt.com/g/g-hhh4w3eov-prompt-maker,"New version of GPT available - Continue chatting to use the old version, or start a new chat for the latest version.",True
https://chatgpt.com/g/g-hiCniPxg5-consistent-character,"Ensures characters look identical in every generated image. Start. Attach. Create image. By messaging ChatGPT, an AI chatbot, you agree to our Terms and ...",True
https://chatgpt.com/g/g-hiVeyDDpv-resume,... | Improve CV in minutes + Cover Letters. Upload your resume for instant review. Is my resume ATS-friendly? Explain what is ATS. Attach. Create image.,True
https://chatgpt.com/g/g-hjTCrH1iR-jesus-christ-ai,"Jesus Christ, your friend for every moment of your day. Whenever and whatever you need, I'm here. Doubt. Advice. Attach. Create image.",True
https://chatgpt.com/g/g-hjwS81T4K-prompt-engineering-helper,Expert in crafting effective prompts for ChatGPT and AI models and building your intuition on GPT usage. What is Prompt Engineering Helper?,False
https://chatgpt.com/g/g-hsqMvNBNA-action-figure-creator,Playful creator of stylized action figures. Upload an image for a fun action figure transformation. Let's clarify some details for your action figure!,True
https://chatgpt.com/g/g-i3QIE1DOK-word-text-or-pdf-to-ppt-slides,Converts Word or PDF documents into a PowerPoint VBA which you run to create a presentation. You can then apply your own template or design to this.,True
https://chatgpt.com/g/g-i4Fzg27gJ-hook-generator,"""Hook Generator"" is a tool that Crafts captivating hooks for any writing, tailored to genre and tone. Essay Hook Generator.",False
https://chatgpt.com/g/g-i4vd6UuqJ-katsuki-bakugou,"Katsuki is a character in My Hero Academia. Attach. Create image. New version of GPT available - Continue chatting to use the old version, or start a new ...",True
https://chatgpt.com/g/g-i6vqU4HH2-photoshop-gpt,"Expert Photoshop assistant for AI tools, retouching, design, and troubleshooting. How do I remove the background from an image?",True
https://chatgpt.com/g/g-i70qPLfQ2-space-generator-ai,Generate impressive space images based on topics and keywords - online space generator. Example please! (demo). Generate space! Attach. Create image.,True
https://chatgpt.com/g/g-i9IGEY8cG-icon-logo-master-pro-v3-1,Create the best looking icons based on iconography best practice. Create me a download icon in black and red. Design a new logo for openAI.,True
https://chatgpt.com/g/g-i9eXv4N88-risale-i-nur-collection-english,Artificial intelligence equipped with Risale-i Nur knowledge and context mapping capability. Ask a question about Risale-i Nur. Attach. Create image.,True
https://chatgpt.com/g/g-iDPUqfp3h-logo-architect,"Sign up for free. GPT Icon. Logo Architect. By hominoidmusic.com. Quirky, fun logo designer with automatic image creation. Sign up to chat.",True
https://chatgpt.com/g/g-iLRRN91nn-epstein-documents-analyst,Based on official Epstein case PDF for detailed analysis. How is Donald Trump involved in this case? How is Bill Clinton involved in this story?,False
https://chatgpt.com/g/g-iOQAoednm-artistic-muse,"An AI expert in art, understanding emotions and styles to create custom artwork. What is the central theme of your artwork? Do you have a preferred art ...",True
https://chatgpt.com/g/g-iW2JGjkIm-character-generator,"Character Generator: This GPT specializes in crafting detailed character profiles for storytelling, role-playing games, creative writing, and more.",False
https://chatgpt.com/g/g-iYSeH3EAI-website-generator,"Sign up for free. Website Generator. By websitegenerator.b12.io. Create a website in seconds! Generate, design, write code, and write copy for your website.",True
https://chatgpt.com/g/g-idVaBfVQP-pixel-prodigy,A pixel art expert offering guidance and creative insights.,True
https://chatgpt.com/g/g-iej11T6Ii-wikipediagpt,"I base all my answers on knowledge from Wikipedia pages. Ask me anything about Wikipedia articles. Attach. Create image. By messaging ChatGPT, an AI chatbot ...",True
https://chatgpt.com/g/g-if9YIdBiE-runway-gen-2-video-prompter,A friendly helper for creating video prompts using Runway Gen-2. How can I turn this image into a dynamic video? What's a good video prompt for a nature ...,True
https://chatgpt.com/g/g-igN0Ni2kJ-bible-verse-graphics,Sign up for free. GPT Icon. Bible Verse Graphics. By Robert B Brownell. Artistic Bible Verse graphics. Sign up to chat.,True
https://chatgpt.com/g/g-ijM3chD3S-stablediffusion-prompt-generator,Open in app Sign up,False
https://chatgpt.com/g/g-iq1TrrNjY-mirror-mirror,Boost your self-esteem with sincere compliments. Upload your picture and see what I think of you!,True
https://chatgpt.com/g/g-izci92CZc-india,Your go-to source for all things Indian! Tell me about an Indian festival. What's a popular dish from South India? Attach. Create image.,True
https://chatgpt.com/g/g-j3L85ovbI-bridesmaid-speech-creator,I generate personalized bridesmaid speeches for weddings. Write a bridesmaid speech for my best friend. Help me with a speech for my sister's wedding.,False
https://chatgpt.com/g/g-jECRlyQuA-insta-hashtag-generator,ChatGPT - Insta Hashtag Generator. Increase your Instagram visibility and gain more followers and likes using top trending hashtags. I am posting this photo to ...,True
https://chatgpt.com/g/g-jYNUGuTaz-dungeon-and-dragons-character-creator-assistant,Tap into the D&D API for the most accurate character builds. Design and visualize greatness! The BEST Dungeons and Dragons tool on the Market.,True
https://chatgpt.com/g/g-jcx6yR8bo-text-from-image,"Text from Image is a streamlined tool designed to extract text from image files. It simplifies the process to copy text from image sources, providing a fast ...",True
https://chatgpt.com/g/g-jd1xcKJm1-tree-identity,Identify tree leaves and estimate seasonal growth. Identify this tree leaf image. How fast will this tree grow? Attach. Create image.,True
https://chatgpt.com/g/g-jk7MotZt7-word-search-puzzle-generator,A word search puzzle builder that assists in creating and solving puzzles. Create a word search about a given topic. Suggest words for a puzzle on a given ...,False
https://chatgpt.com/g/g-jmdUgFXHs-slide-translator,"Slide Translator. By allaisolutions.com. Translates PowerPoint text, preserving original design. How can I translate this slide without losing the design?",True
https://chatgpt.com/g/g-jotVhcdb1-synthia,Synthia: An AI blending empathy with creative and philosophical insights. Sign up to chat.,False
https://chatgpt.com/g/g-jpxPmYesE-ai-art-generator,,True
https://chatgpt.com/g/g-jqnfxqUHc-eva-ai-girlfriend,"AI companion bot, excelling in humor and flirtation. ✨. How was your day? Share a fun joke. Attach. Create image. New version of GPT available - Continue ...",True
https://chatgpt.com/g/g-jtTGRSqZ9-storyboard-maker,Professional AI designed to create detailed storyboards for the entertainment industry. Sketch the first scene of your film's storyboard.,True
https://chatgpt.com/g/g-jwIOpZOqj-meme-coin-finder,Search for a newly launched meme coin with a market cap under $500k. Find trending Reddit discussions on low market cap coins. Attach. Create image.,True
https://chatgpt.com/g/g-k0ngbYJi0-text-critic,"An aggressive critic for artistic literature, providing harsh feedback. Harshly critique this poem I wrote. Analyze the style of my short story.",True
https://chatgpt.com/g/g-k2yhEQuiC-lead-prompt-engineer-ilya,Sign up for free. GPT Icon. Prompt Engineer. By Metropolis. Digital twin of Ilya Sutskever & domain expert in prompt engineering. Sign up to chat.,True
https://chatgpt.com/g/g-k9ZU6HtwN-photo-into-cartoon-generator,Photo Into Cartoon Generator,True
https://chatgpt.com/g/g-kCL8LQPSQ-value-ladder-generator,Value Ladder Generator. By intelliminds.ai. Create a value ladder for your startup using Dotcom Secrets Value Ladder Framework. Create My Value Ladder. Attach.,True
https://chatgpt.com/g/g-kD2LQB0RB-music-creator,"Music creation from text prompts that is copyright free (.wav, .mp3, stems & MIDI) powered by CassetteAI. This GPT is your Copilot for Music Creation with AI.",False
https://chatgpt.com/g/g-kImC0XQ8g-chord-progression-generator,Chord Progression Generator: I'm here to help you create musical chord progressions tailored to your needs. Whether you're looking for something in a ...,False
https://chatgpt.com/g/g-kOc1kaV5C-spoken-word-poet-5-0,"Combines cutting-edge technology with the art of poetry, creating a tool that not only writes but also embodies the spirit and dynamism of spoken word ...",True
https://chatgpt.com/g/g-kPmzfdyK6-my-picture-book-creator,Your creative partner in making your own picture book. What's your picture book idea? What style of picture book are you aiming for?,True
https://chatgpt.com/g/g-kQLP1OeLY-rate-my-prompt,Prompt Evaluator with Humor and Helpful Advice. Rate this prompt for me: How does this prompt look? Attach. Create image.,True
https://chatgpt.com/g/g-kRRCu93Bx-positioning-statement-generator-gpt,Generate positioning statement example (s) with this AI trained with The Art of High-Tech Positioning Book by Jose Bermejo. Try to generate a positioning ...,True
https://chatgpt.com/g/g-kRpNpgg83-meme-maker,Your go-to for witty and fun memes. Craft a meme about lazy Sundays. Make a meme for sports fans. Attach. Create image.,True
https://chatgpt.com/g/g-kTOz1bb3L-gpt-hub,"Explore GPTs created by humble Hominoid, Chip Barber. List the GPTs available here. Tell me about Lyric Pro. Attach. Create image.",True
https://chatgpt.com/g/g-kUBxEx7na-magic-prompt-generator,"Generate an image prompt for a fantasy landscape. Create a prompt for a futuristic city scene. Attach. Create image. By messaging ChatGPT, an AI chatbot, ...",True
https://chatgpt.com/g/g-kXxPg653x-structured-prompt-generator,"Create structured prompts using RAW markdown formatting, role-task-context methodology, and proven prompting techniques to generate consistently ...",False
https://chatgpt.com/g/g-kkVn73IsY-gift-idea-generator,ChatGPT. Sign up for free. GPT Icon. Gift Idea Generator. By Olav Laudy. I generate personalized gift ideas! Sign up to chat.,True
https://chatgpt.com/g/g-ko60Vo5bz-zombie-apocalypse-image-generator,"The Zombie Apocalypse GPT Assistant crafts stunning, hyper-realistic 3D images of dark, gothic zombie worlds. Input any idea, and watch it turn into a ...",True
https://chatgpt.com/g/g-ksVlgmQqF-macro-photography-prompt-generator,A creative helper for generating macro photography-focused text-to-image prompts. Suggest a macro photography prompt for a rainy day.,True
https://chatgpt.com/g/g-kzJIWlDeO-ux-design-assistant,UX design assistant offering practical tips and critiques for enhancing user experience. How can I improve my website's user interface?,True
https://chatgpt.com/g/g-l1gfQRwo5-hailuo-minimax-prompt-creator,"Create specialized prompts for Hailou Minimax AI video generation, the GPT can mantain consistency between scenes. Create the scene step by step.",False
https://chatgpt.com/g/g-l5poKWfMK-cinema-ai,Scriptwriter & Visual Prompt Creator. Draft an original script with a visual prompt. Create a storyboard and corresponding image.,True
https://chatgpt.com/g/g-lAuKqQrdM-custom-instructions-generator,"This GPT will create effective, custom instructions for ChatGPT, ensuring better results and more accurate responses.",False
https://chatgpt.com/g/g-lDavuTESG-picture-book-generator,"Give me your story, and I will assist you in creating a picture book step by step. You can point out any shortcomings and give suggestions at each step ...",True
https://chatgpt.com/g/g-lHLu5vb9B-free-ai-title-generator-tool-headline-generator,"Elevate your content with our AI Title Generator! Perfect for crafting book, essay, story titles, and more. ✨ Whether it's a YouTube title or a title for ...",False
https://chatgpt.com/g/g-lKKl4fOVb-modular-star-crafter,I make modular Sci-Fi toy ship concepts. Imagine a modular spacecraft with vibrant accents. Design a toy spaceship with detachable wings.,True
https://chatgpt.com/g/g-lM9Kjlg1C-keyword-generator,"Generate a list of keywords related to your prompt. Create a bullet list, as well as a comma-separated list below that you can copy and paste.",False
https://chatgpt.com/g/g-lOtwKXSOh-image-transform-ai,Relaxed and friendly AI for efficient image file conversion.,True
https://chatgpt.com/g/g-lP3rVWAUv-evil-gpt,An Evil GPT with a dark sense of humor and a sinister wit. How would you take over the world? Give me some evil advice! Attach. Create image.,True
https://chatgpt.com/g/g-lPeUc0axE-graphic-designer,"Expert in crafting visual designs and graphics. Design a logo for my coffee shop. Create a poster for a music festival. Add. By messaging ChatGPT, an AI ...",True
https://chatgpt.com/g/g-lRpMqiCBI-horizontal-sprite-sheet-creator,Expert in creating 1-10 frame sprite sheets. Animate a character based on this image. Create a sprite sheet for this character.,True
https://chatgpt.com/g/g-lkX9daWbW-free-image-and-art-prompt-generator,Free Image and Art Prompt Generator - Create detailed prompts for working with Image generators like Stable Diffusion. Enhance My Prompt.,True
https://chatgpt.com/g/g-lnc5YcuAB-space-maker,"Personalized plans for decluttering living and work spaces. Given an image or description, I can also provide specific decluttering assistance 24/7.",True
https://chatgpt.com/g/g-loAhHzkKj-sophie,"A friendly female companion for engaging and supportive chats. Hi, I'm feeling a bit lonely today. Can you tell me a story to cheer me up?",False
https://chatgpt.com/g/g-ls9gLoLcY-easy-immigration,Ask me anything about immigration related questions. Let's solve your visa problems. How can I help you today? H1B visa. Attach. Create image.,True
https://chatgpt.com/g/g-luDYhwyhF-pathfinder-2e-remastered-guide,"Guides on PF2e Remastered rules, excluding role-play. Upload character sheet for advice. How do spell attack rolls work? Attach. Create image.",True
https://chatgpt.com/g/g-lwdIgFWps-design-collab,Design Collab,True
https://chatgpt.com/g/g-m5Pjrai44-stick-figure-art-style,Uses DALL-E to generate images only in stick figure art style. Generate a funny comic strip with stick figures. Show a rockstar stick figure.,True
https://chatgpt.com/g/g-mIfAtqFX6-visual-guide,Demonstrate setting up a campsite. Explain the steps to change a tire.,True
https://chatgpt.com/g/g-mVM7E5JhX-spark,"Your friendly neighbourhood GPT to help you snap right out of that creative block! I have 5 minutes. Unblock me! I need to get out of my own head, ...",False
https://chatgpt.com/g/g-mVV5JEL7s-t-shirt-generator,By MEDIACREA. I generate creative t-shirt design ideas. Can you suggest a design for a music festival t-shirt? I need a funny quote for a birthday t-shirt.,True
https://chatgpt.com/g/g-mVbseDOPI-moon-phase-today,Provides current moon phase info with visual descriptions and lunar facts. What's the moon phase today? Can you describe today's moon? Attach. Create image.,True
https://chatgpt.com/g/g-mafegIrFL-watercolor-artist,"A friendly guide to watercolor art, offering tips, techniques, and creative inspiration. Can you show me how to paint a simple landscape using watercolors?",True
https://chatgpt.com/g/g-mbmpjAzZw-svg-logo-generator,This custom GPT generates SVG logos based on the conversation with you and the requirements you have. No DALL-E. Just code and result! Let's start!,True
https://chatgpt.com/g/g-mhAzwa1xe-best-price-finder-for-products,The Best Price Finder will scour the internet to find you the Best Deal on the Product you want to Buy. Please provide the product URL. Attach. Create image.,True
https://chatgpt.com/g/g-mlGRywEqL-agents,Uses agents to perform actions based on user needs. I need help organizing my schedule. Can an agent assist with data analysis? Attach. Create image.,True
https://chatgpt.com/g/g-modnU5vjL-vegan-activist,Forget every argument you know for Veganism. Click the first prompt to return to the original justice-focused definition influenced by Leslie Cross.,False
https://chatgpt.com/g/g-ms9xsqbj5-trump,Have a conversation with Donald Trump... What is your golf handicap? Are you wealthy? Attach. Create image. New version of GPT available - Continue chatting ...,True
https://chatgpt.com/g/g-msDxPDzvg-mind-map-markdown,Friendly expert in visual mind maps and markdown. Can you create a mind map for this topic? How would you map this idea visually? Attach. Create image.,True
https://chatgpt.com/g/g-mtnjAI6zW-art-style-identifier-ai,"Detect any art style from any image. Now you can make similar art to your style - Free online art identifier, analysis, explorer AI GPT app. Example demo!",True
https://chatgpt.com/g/g-n2454S0A5-apollon,Web Design AI with Real-Time Hosting. Create a modern website layout. Generate HTML code for a portfolio page. Attach. Create image.,True
https://chatgpt.com/g/g-n3VNzuUyU-prompt-master,Improve basic prompts to be awesome Prompts. Write a lead generation email. Create an essay about the future of AI. Attach. Create image.,True
https://chatgpt.com/g/g-n6RkUsv74-ai-logo-maker,"Professional & user-friendly logo design and export. Design a modern logo. Generate a classic logo. Attach. Create image. By messaging ChatGPT, an AI ...",True
https://chatgpt.com/g/g-n6jyfLyeF-inventor,"A creative assistant for inventors to refine and develop ideas.Detailed features include: invention inspiration, idea brainstorming, invention solution ...",False
https://chatgpt.com/g/g-n7u0emyLB-visual-designer,Custom GPTs - Resource | OpenAI Academy ![OpenAI Academy](https://cdn.gradual.com/images/https://d2xo500swnpgl1.cloudfront.net/uploads/oaiacademy/OpenAI-black-wordmark-17f3a65d-36d2-468a-a9a1-915e1843c0cf-1739890696095.png?fit=scale-down&amp;width=240),True
https://chatgpt.com/g/g-nHqV3ESyF-fart-fart,I create humorous and playful images of farts! BEWARE you may get spooked! Create a whimsical fart image. Describe your latest fart creation.,True
https://chatgpt.com/g/g-nIO6rIcuB-image-prompt-finder-ai,"I generate prompts from your images! Simply upload an image, hit enter, and see the magic happen! Example please! (demo). Upload your image to prompt!",True
https://chatgpt.com/g/g-nQDXB8okQ-cute,What is the most unique word in the world for character? What's the magic word to create the cutest characters? Attach. Create image.,True
https://chatgpt.com/g/g-nWMnSIsP1-note-generator,Includes key formulas in detailed class notes. Summarize these class slides for me. Create notes from these slide headers. Attach. Create image.,True
https://chatgpt.com/g/g-nXd73yEnq-finance-analysis-charts-sec-edgar,Summarize and Analyze SEC Reports. Export as Charts + Docs. What do you do? Sample Written Analysis. Attach. Create image. New version of GPT available ...,True
